{
  "brief_hash": "81ed33b8",
  "iteration": "001",
  "stage": "gen",
  "content": "# 못 넘긴다고 믿은 일은 계속 내 일이 된다\n\n코드가 1000줄, 2000줄로 불어나면 지식보다 먼저 믿음이 무너진다. 결제 기능을 붙이던 때, 로직은 여기저기로 흩어졌고 거대한 클래스 하나를 바꾸려면 무엇을 건드려야 하는지보다 이 코드가 괜찮은지 판단할 근거가 먼저 필요했다.\n\n나는 AI가 어디까지 대체할 수 있는지 궁금했다. 대체될까 봐 걱정한 것이 아니라, 어디까지 넘길 수 있는지 알고 싶어서 한 칸씩 밀어봤다.\n\n## 1단: 타이핑을 넘기고 지시는 남았다\n\n처음에는 AI를 도구로 썼다. 물어보고, 코드를 작성해달라고 하고, 검토해달라고 했다. 같은 프롬프트를 다시 쓰고, 반복 작업을 맡기고, 작은 작업을 잘라 넘겼다.\n\n이 단계에서 넘어간 것은 타이핑에 가까웠다. 무엇을 시킬지, 어디까지가 맞는지, 결과를 받아들일지는 그대로 내가 정했다. AI는 손을 덜어줬지만 판단의 자리는 옮겨가지 않았다.\n\n## 2단: 판정을 넘기자 기준이 남았다\n\n다음에는 AI가 스스로 판단할 수 있는지 물었다. 그냥 물어보면 항상 다른 답이 왔다. 같은 코드에 대해 어떤 때는 심각도가 낮다고 하고, 어떤 때는 높다고 했다. 전후를 비교하려 해도 판정 자체가 흔들리니 기준으로 쓰기 어려웠다.\n\n그래서 결정적으로 보이도록 판단 기준을 내려줬다. 채점표를 최대한 셀 수 있게 만들고, 점수를 매길 수 있게 바꿨다. 그러자 응답의 일관성과 내용은 나아졌다. 이때부터 AI는 단순한 도구보다 에이전트에 가까워졌다.\n\n하지만 기준을 줬다고 기준 문제가 사라진 것은 아니었다. 같은 코드에 대한 기록을 나란히 놓았을 때 그 점이 분명해졌다. 내가 쓴 `refund.feature`의 18개 시나리오로 B 구현을 돌렸더니 16개가 통과하고 2개가 실패했다. 실패한 것은 앱스토어 결제 주문 환불 거절과 구글 플레이 결제 주문 환불 거절이었다. 원인은 분명했다. B의 `Order`에는 결제 플랫폼 개념 자체가 없어서 외부 스토어 결제를 거절하지 않고 통과시켰다.\n\n반면 같은 B 코드를 AI가 자기 평가했을 때는 다른 이야기를 했다. 수동 환불 우선 원칙, 7일 무료 환불 규칙, 생성자의 불변식, 오케스트레이션 계층 같은 잠재적 문제를 짚었다. 실제로 실패한 플랫폼 거절 누락은 한 줄도 나오지 않았다.\n\n여기서 버린 안이 하나 있다. 코드를 짠 AI에게 그 코드를 평가하게 하고, 그 평가를 합격 근거로 쓰는 안이다. 인수테스트가 잡은 것은 Pass/Fail로 재현되는 결함이었고, AI 자기 평가는 그럴 수 있다는 추상적 지적이었다. 주 판정은 코드 바깥의 명세로 고정된 인수테스트가 맡고, AI 평가는 보조 결과로 두는 쪽이 맞았다.\n\n그 뒤에도 기준은 한 번 더 깨졌다. 첫 루브릭은 다섯 축으로 서로 다른 초안 세 편에 `structure 4.0 / evidence 4.0 / originality 4.0`을 세 번 똑같이 줬다. 도입도 문체도 분량도 결론도 다른 글이었다. 서술어가 “자연스럽게 이어진다”, “단단히 받친다” 같은 좋음의 정도였기 때문이다.\n\n그래서 v2에서는 서술어를 확인 가능한 요소의 유무로 바꾸고 축을 여덟 개로 늘렸다. 판단 과정, 근거, 독자 정렬, 근거 추적 같은 축을 분리했다. 특히 근거 추적은 최소점을 4.0으로 뒀다. 날조는 품질 등급이 아니라 참과 거짓에 가까워서 3점대를 허용할 이유가 없었다.\n\n이 단계에서 넘긴 것은 판정이었다. 남은 것은 그 판정이 기대는 기준을 쓰는 일이었다. 그리고 내가 처음 쓴 기준은 기준이 아니었다.\n\n## 3단: 검토와 재작성을 넘기자 점수를 믿을 근거가 남았다\n\n그다음에는 AI가 스스로 검토해서 품질을 올릴 수 있는지 물었다. 판단 기준으로 점수를 매기고, 그 점수를 토대로 다시 고쳐 쓰는 파이프라인을 만들었다. 사람이 검토하고 재작성하던 자리를 AI가 메꿨다.\n\n처음에는 통과선도 버렸다. 낮게 두면 첫 산출물이 대부분 통과해 검토와 고쳐 쓰기가 실행되지 않았다. 높게 두면 같은 재료로 네 번 고쳐도 미달이었고, 그 위로 가려는 퇴고는 재료에 없는 문장을 만들었다. 통과선은 품질을 올리는 손잡이처럼 보였지만, 잘못 잡으면 루프 자체를 멈추거나 거짓을 부추겼다.\n\n점수만으로도 부족했다. 점수 트랙은 루브릭 8축으로 0~5점을 매기고 가중 총점과 축별 최소점으로 걸렀다. 계약 트랙은 점수와 무관하게 기계로 확인 가능한 것만 봤다.\n\n| 계약 검사 | 실제로 막은 것 |\n|---|---|\n| 출력이 JSON을 이중으로 감쌌는가 | 초안 대신 JSON 덩어리가 들어갔는데 평가자가 4.165점을 주고 통과시킨 사례 |\n| 목표 분량 범위 | 3000-4000자 요청에 4242자 |\n| 금칙 리터럴과 기법 용어 노출 | 규칙 용어가 본문에 그대로 나옴 |\n| 귀속된 인용이 재료에 있는가 | 재료에 없는 인용 |\n| 1500자 이상 글의 소제목 | 3337자 통글 |\n| 가중치와 총점 일치 | 과거 아티팩트 14개 중 8개가 어긋남 |\n\n점수로는 통과할 초안을 계약이 막은 경우가 다섯 번 있었다. 반대로 계약은 통과했지만 점수가 모자란 경우도 있었다. 둘은 다른 실패였고, 그래서 종료 사유도 따로 남겼다.\n\n더 큰 문제는 날조였다. “판정 장치를 만들면 마음이 편해질 줄 알았다. 실제로는 반대였다.” 같은 1인칭 심경, “사람이 직접 짠 코드라면 적어도 어느 순간에 왜 그렇게 했는지 기억이라도 남는다.” 같은 경험 서술, “처음에는 빠르게 보였다.” 같은 문장이 재료 없이 들어왔다. 전부 글을 그럴듯하게 만드는 자리에 있었다.\n\n루브릭은 이것을 못 잡았다. 실제로 날조가 있는 초안이 근거 추적 축에서 4.8을 받고, 없는 초안이 4.5를 받았다. 방향이 반대였다. 구체적으로 쓰인 거짓이 모호하게 쓰인 진실보다 근거 있어 보였기 때문이다.\n\n그래서 탐지를 채점이 아니라 대조로 옮겼다. 본문의 1인칭 서술을 brief와 하나씩 맞춰 근거 없는 것을 목록으로 냈다. 같은 프롬프트로 날조 있는 초안에서는 4건이 나왔고, 깨끗한 초안에서는 0건이 나왔다.\n\n이 단계에서 넘긴 것은 검토와 재작성이다. 남은 것은 그 점수를 믿을 근거였다.\n\n## 4단: 유지보수를 넘기자 잣대를 고칠 자격이 남았다\n\n그다음 질문은 파이프라인을 유지보수하는 일도 AI가 할 수 있는가였다. 비평, 평가 기준, 점수 로그가 남으니 그 내용을 토대로 스스로 개선할 수 있지 않을까 싶었다. 그래서 기존 루프와 다른 느린 루프를 만들었다. 에이전트, 프롬프트, 스키마를 고치는 제안을 내는 루프였다.\n\n여기서 낮은 점수를 곧바로 수정 대상으로 연결하는 경로는 버렸다. `evidence = 3.0`의 원인은 여러 곳일 수 있었다. 생성이 근거를 약하게 썼을 수도 있고, 퇴고가 근거를 못 살렸을 수도 있고, 기준이 잘못 맞춰졌을 수도 있고, 평가가 근거 축을 과소평가했을 수도 있고, intake가 근거 될 재료를 못 담았을 수도 있었다. 낮은 점수는 “어디가 아픈지”를 말해도 “무엇을 고쳐야 하는지”까지 말하지 않는다.\n\n그래서 신호 집계는 코드가 하고, 수정 제안은 LLM이 하고, 기준 변경은 사람이 하게 했다. 실제 제안도 나왔다. `brief.constraints.emphasis`를 방향 제약으로만 반영하라고 되어 있어 강조 주제가 글의 비중 중심이 되지 않는다는 진단이었다. 제안은 target file, target axis, effect path, alternatives considered, side effects, diff까지 적어 왔다. 이 제안은 실제로 적용됐다. 이어서 raw_text의 핵심 기술 결정과 설계 판단을 생략하지 말라는 지시, 결론을 한계 나열이 아니라 판단이나 실험 단서로 닫으라는 지시도 적용됐다. 세 건 모두 2026년 6월 30일 변경 이력에 남았다.\n\n이 단계에서 넘긴 것은 유지보수와 개선의 일부였다. 남은 것은 잣대를 고칠 자격이었다.\n\n## 세로로 한 칸 더 올라가는 길은 막았다\n\n여기서 세로로 한 칸 더 올라갈 수도 있었다. 느린 루프가 자기 자신이 쓰는 루브릭과 프롬프트까지 고치게 하면 된다. 하지만 그 경로는 못 만든 것이 아니라 막았다.\n\n이유는 단순하다. 채점표가 곧 최적화 목표가 되고, 채점표를 바꾸는 순간 그 항목의 전후 비교는 정의상 무효가 된다. 느린 루프가 자기 심판까지 고치면 순환이 끊기지 않는다. 그래서 slow loop이 쓰는 rubric과 prompt는 사람만 바꾸게 했다.\n\n이때 버린 것은 “낮은 점수를 잣대를 고칠 근거로 쓰는 경로”와 “느린 루프가 자기 심판까지 고치는 경로”였다. 대신 채점표를 고칠 자격을 얻는 유일한 경로를 따로 남겼다. 사람 verdict가 붙은 과거 산출물을 얼려두고, 새 rubric으로 다시 채점한 뒤 어느 쪽이 사람 판정과 더 가까운지 보는 방식이다.\n\n정직한 제약도 같이 남았다. rubric을 신뢰성 있게 바꿀 수 있는 속도는 사람 판정이 쌓이는 속도에 묶인다. 지금 통과선 4.2는 관측된 점수 분포에서 고른 값이지 사람 판정에서 역산한 값이 아니다. 초안 아홉 편을 남겨뒀지만 판정란은 비어 있다.\n\n## 같은 사다리는 옆으로도 놓였다\n\n지금까지는 내가 만들어온 글쓰기 하네스를 기본으로 생각했다. 그런데 대체할 수 있는 것은 그 안에만 있지 않았다. 요즘 콘텐츠 자동화를 만들면서 같은 사다리를 다른 곳에서 다시 올라갔다.\n\n받은 스토리보드가 빈약해서 바로 들어가기 어려웠다. 예전 같으면 내가 먼저 보완하고, 그다음 인터뷰를 수동으로 했을 일이다. 이번에는 먼저 스토리보드를 구체화하는 에이전트를 만들었다. 그리고 그 응답을 토대로 인터뷰어와 인터뷰이를 만들어 내가 하던 인터뷰를 자동화했다.\n\n여기서 버린 생각은 “아직 안 넘어간 일은 원래 못 넘기는 일”이라는 판단이었다. 사람 둘이 마주 앉아 하는 인터뷰도 넘어갔다. 사다리가 도메인에 안 묶인다는 판단은 아직 사례가 두 개뿐이지만, 적어도 한 도메인에서 오른 단을 다른 도메인에서 다시 밟을 수는 있었다.\n\n그래서 “결국 사람이 다 해야 한다”는 결론도 버렸다. 네 단에서 넘긴 것들은 실제로 넘기는 게 맞았고, 넘긴 뒤가 더 나았다. 다만 넘긴 뒤에도 남는 자리가 바뀌었을 뿐이다.\n\n## 남은 것들은 한자리로 모인다\n\n단마다 남긴 것은 다르게 보였지만 결국 한곳으로 모였다.\n\n```text\n도구        -> 무엇을 시킬지\n판정        -> 기준을 쓰는 일\n검토/재작성 -> 점수를 믿을 근거\n유지보수    -> 잣대를 고칠 자격\n```\n\n채점표로 판정해도 그 점수가 맞는가. 채점표를 바꿔버리면 의미가 있는가. 설계는 누가 하는가. 이 질문들은 서로 다른 단계에서 나온 것처럼 보였지만 모두 “무엇으로 올바름을 잴 것인가”로 모였다.\n\n빠뜨림도 둘로 갈렸다. 요구사항을 안 적은 경우는 이미 대고 있는 잣대 안에서 어떤 경우를 안 본 것이다. 같은 방식으로 더 많이 시험하면 언젠가 걸릴 가능성이 있다. 하지만 잴 잣대 자체를 안 챙긴 경우는 다르다. 두 구현이 지금 대는 모든 잣대에서 똑같이 보이면 아무리 열심히 시험해도 안 걸린다. 애초에 그 차이를 드러낼 잣대가 없기 때문이다.\n\n이 배치가 깨지는 조건도 있다. 세로로 막힌 것이 원리가 아니라 순서라는 판단은 아직 추정이다. 사람 판정을 쌓아 열어봐야 확인된다. 사람 판정이 채점표보다 낫다는 전제도 아직 검증하지 못했다. 사다리가 도메인에 안 묶인다는 판단은 사례가 두 개뿐이다. 사람이 잣대를 계속 들여다볼 시간이 있을 때만 이 배치가 성립하는데, 승인에 드는 시간도 아직 재지 못했다. 넘긴 판단 중 반쯤만 결정적인 것이 섞여 있으면 통과는 하는데 틀린 산출물이 늘어날 수 있고, 어디까지 결정적인지도 아직 다 재보지 못했다.\n\n## 성장이라고 부르는 것\n\n이 작업에서 내가 성장이라고 부르는 것은 AI가 할 수 있는 일을 더 많이 믿는 상태가 아니다. 한 칸을 넘겨보고, 그 칸에서 남은 것을 이름 붙이고, 남은 것이 다시 넘길 수 있는지 확인하는 상태다.\n\n그 정의에는 대가가 있다. 자동화가 늘어날수록 손에서 빠지는 일은 많아지지만, 잣대를 보는 일은 더 또렷하게 남는다. 점수 분포를 보고, 계약 실패를 따로 남기고, 날조를 대조하고, 사람 판정이 비어 있다는 사실을 숨기지 않아야 한다. 넘기는 일은 줄이는 일이 아니라 남는 일을 더 정확히 드러내는 일에 가까웠다.\n\n어디까지 했는지는 분명하다. 타이핑을 넘겼고, 판정을 넘겼고, 검토와 재작성을 넘겼고, 유지보수 제안까지 넘겼다. 같은 사다리를 콘텐츠 자동화에서도 다시 올렸다. 무엇을 못 했는지도 분명하다. 사람 판정을 채우지 못했고, 독자 정렬 축이 실제로 나아지는지 확인하지 못했고, 스피치 리허설 에이전트도 만들지 못했다.\n\n다음에 할 일은 새 칸을 더 멀리 상상하는 것이 아니다. 판정란이 비어 있는 산출물부터 채우고, 얼린 기준점 위에서 새 채점표가 사람 판정에 더 가까워지는지 보는 것이다. 못 넘긴다고 믿은 일은 계속 내 일이 되지만, 한 번 밀어본 일은 더 이상 같은 모양으로 남아 있지 않다.",
  "generated_at": "2026-08-24T14:40:40+09:00",
  "model": "gpt-5.5",
  "metadata": {
    "prompt_version": "gen_system:v1",
    "source_files": [
      "81ed33b8_input.json"
    ],
    "token_usage": {
      "input_tokens": 32711,
      "cached_input_tokens": 2432,
      "output_tokens": 4287,
      "reasoning_output_tokens": 516
    }
  }
}
