{
  "brief_hash": "a1b2c3d4",
  "iteration": "002",
  "stage": "refine",
  "content": "처음 글쓰기 하네스를 설계할 때는 좋은 프롬프트 하나만 잘 다듬으면 초안 품질이 자연스럽게 올라갈 거라고 생각했다. 생성 모델에 더 정확한 지시를 주고, 출력 형식을 단단히 잡으면 반복 작업도 쉽게 정리될 것처럼 보였다. 그런데 실제로 구조를 잡기 시작하자 병목은 프롬프트 문장보다 그 프롬프트가 오가는 경계에 있었다. 어떤 단계가 무엇을 책임지고, 무엇을 보지 않아야 하는지, 어디까지를 파일 계약으로 고정할지 정하지 않으면 흐름이 금방 흔들렸다.\n\n가장 먼저 드러난 시행착오는 `runner.py`에 책임이 계속 쌓였다는 점이다. 처음에는 실행만 묶어주면 된다고 생각했지만, 입력 JSON을 읽고 단계별 payload를 조립하고, 중간 산출물을 저장하고, `validate.py`를 호출하고, 실패를 정리하는 일까지 한곳으로 모이기 시작했다. 그 순간부터 runner는 흐름 제어만 하는 자리가 아니라, 각 단계가 무엇을 쓰고 무엇을 읽어야 하는지까지 대신 결정하는 쪽으로 기울었다. 코드는 한 파일에 모여 편해 보였지만, 구조는 점점 무거워졌다. 그래서 `runner.py`는 흐름만 제어하고, 생성과 검증의 책임은 각 단계로 다시 돌려보내는 방향으로 정리했다.\n\n이 작업에서 가장 중요했던 것은 역할 분리였다. Generator, Critique, Eval, Refine, Validate를 나누려는 이유는 파일을 쪼개기 위해서가 아니었다. 각 단계가 자기 역할 밖의 정보를 보지 않게 해야 실패 원인이 선명해지고 수정도 쉬워진다. Generator는 초안만 만들고, Critique는 약점만 짚고, Eval은 루브릭만 보고, Refine는 비평을 반영해 다시 쓰고, Validate는 결과물이 계약을 지키는지만 확인한다. 단계가 많아 보이더라도 핵심은 단순하다. 무엇을 더 볼지 늘리는 것이 아니라, 무엇을 보지 않게 할지 정하는 일이다.\n\n특히 `validate.py`는 문학적 품질을 판단하지 않도록 선을 분명히 그었다. 여기서 해야 하는 일은 schema, 길이, 금칙어, 필수 필드처럼 기계적으로 확인할 수 있는 계약만 보는 것이다. 글이 좋은지 나쁜지는 다른 단계가 다룰 문제이고, validate가 그 판단까지 가져가면 계약 오류와 편집 판단이 섞여 버린다. 그렇게 되면 무엇이 깨졌는지부터 다시 흐려진다. 이번 설계에서는 그 혼선을 피하는 쪽이 더 중요했다.\n\n그래서 MVP도 `input.json -> gen -> draft.json -> validate`까지만 먼저 고정하기로 했다. 처음부터 모든 단계를 다 넣으면 하네스가 글쓰기 도구가 아니라 프레임워크 자체를 설명하는 장치가 되기 쉽다. 반대로 최소 경로를 먼저 고정하면 실제로 무엇이 필요한지 확인할 수 있다. 다음 실험에서는 이 최소 경로를 반복 실행하면서 어떤 계약이 가장 자주 흔들리는지, 어느 단계에 정보가 몰리는지, 실패 원인이 구조 문제인지 출력 문제인지부터 차분히 확인해 볼 생각이다.",
  "generated_at": "2026-06-14T16:46:17+09:00",
  "model": "gpt-5.4-mini",
  "metadata": {
    "prompt_version": "refine_system:v1",
    "source_files": [
      "a1b2c3d4_input.json"
    ],
    "token_usage": {
      "input_tokens": 33472,
      "cached_input_tokens": 19200,
      "output_tokens": 1732,
      "reasoning_output_tokens": 930
    }
  }
}
