{
  "brief_hash": "a1b2c3d4",
  "iteration": "003",
  "stage": "refine",
  "content": "처음 글쓰기 하네스를 설계할 때는 좋은 프롬프트 하나만 잘 다듬으면 초안 품질이 자연스럽게 올라갈 거라고 생각했다. 생성 모델에 더 정확한 지시를 주고, 출력 형식을 단단히 잡으면 반복 작업도 쉽게 정리될 것처럼 보였다. 그런데 실제로 손을 대기 시작하자 병목은 프롬프트 문장보다 그 프롬프트가 오가는 경계에 있었다. 어떤 단계가 무엇을 책임지고, 무엇을 보지 않아야 하는지 정하지 않으면 흐름이 금방 흔들렸다.\n\n가장 먼저 드러난 시행착오는 `runner.py`에 책임이 계속 쌓였다는 점이다. 입력 JSON을 읽고, 단계별 payload를 조립하고, 중간 산출물을 저장하고, `validate.py`를 호출하고, 실패를 정리하는 일까지 한곳으로 모이기 시작했다. 그때부터 runner는 단순한 흐름 제어가 아니라, 각 단계가 무엇을 써야 하고 무엇을 읽어야 하는지까지 대신 결정하는 자리로 바뀌었다. 수정할 지점이 늘어날수록 이 파일 하나만 계속 만지게 되었고, 코드는 편해 보여도 구조는 빠르게 무거워졌다. 그래서 `runner.py`는 실행 순서만 관리하고, 생성과 검증의 책임은 다시 각 단계로 돌려보내는 쪽으로 방향을 잡았다.\n\n이 작업에서 가장 중요했던 것은 역할 분리였다. Generator, Critique, Eval, Refine, Validate를 나누는 이유는 파일 수를 늘리기 위해서가 아니다. 각 단계가 자기 역할 밖의 정보를 보지 않게 해야 실패 원인이 선명해지고, 고칠 지점도 또렷해진다. Generator는 초안만 만들고, Critique는 약점만 짚고, Eval은 루브릭만 보고, Refine는 비평을 반영해 다시 쓰고, Validate는 결과물이 계약을 지키는지만 확인한다. 특히 `validate.py`는 문학적 품질을 판단하지 않도록 선을 분명히 그었다. 여기서 해야 하는 일은 schema, 길이, 금칙어, 필수 필드처럼 기계적으로 확인할 수 있는 계약만 보는 것이다. 좋은 글인지 아닌지는 다른 단계가 다룰 문제이고, 그 판단까지 섞이면 계약 오류와 편집 판단이 함께 흐려진다.\n\n그래서 MVP도 `input.json -> gen -> draft.json -> validate`까지만 먼저 고정하기로 했다. 처음부터 모든 단계를 다 넣으면 하네스가 글쓰기 도구가 아니라 프레임워크 자체를 설명하는 장치가 되기 쉽다. 반대로 최소 경로를 먼저 고정하면 실제로 무엇이 필요한지 확인할 수 있다. 다음 실험에서는 이 최소 경로를 반복 실행하면서, 가장 먼저 흔들리는 계약이 무엇인지, payload 경계가 어디서 무거워지는지, 그리고 첫 실패가 구조 문제인지 출력 문제인지부터 좁혀서 검증해 볼 생각이다.",
  "generated_at": "2026-06-14T16:48:40+09:00",
  "model": "gpt-5.4-mini",
  "metadata": {
    "prompt_version": "refine_system:v1",
    "source_files": [
      "a1b2c3d4_input.json"
    ],
    "token_usage": {
      "input_tokens": 16340,
      "cached_input_tokens": 2432,
      "output_tokens": 1206,
      "reasoning_output_tokens": 516
    }
  }
}
