{
  "brief_hash": "325f4859",
  "iteration": "001",
  "stage": "gen",
  "content": "# AI가 짠 코드는 무엇을 통과해야 하나\n\n같은 코드를 두고 AI에게 “잘 짰는지” 물으면 답이 매번 조금씩 달라진다. 그 답이 매끄러워도, 통과와 실패가 흔들리는 순간 그것은 판정 장치가 아니다.\n\n## 비결정적인 판정은 판정이 아니다\n\nAI가 짠 코드를 검토할 때 처음 걸린 지점은 구현 자체가 아니었다. 무엇으로 이 코드를 통과시킬 것인가가 먼저였다.\n\n코드를 다시 AI에게 보여주고 평가를 받는 방식은 편하다. 하지만 같은 구현을 두고 어떤 때는 중간 위험이라고 하고, 어떤 때는 낮은 위험이라고 하면 그 판단은 게이트가 될 수 없다. 실패해야 할 코드를 놓쳤는데 문장만 그럴듯하면 더 위험하다.\n\n그래서 요구사항을 넣으면 기계가 테스트를 뽑고, 그 테스트가 명세 노릇을 하는 구조를 먼저 그렸다. 여기까지는 자연스러웠다. 문제는 그 테스트가 무엇을 고정해야 하는지였다.\n\n## 정책만 받고, 케이스는 만들게 했다\n\n지금 돌리는 하네스는 자연어 정책을 실행 가능한 명세로 고정하는 파이프라인이다. 입력에는 정책만 넣는다. 테스트 케이스는 넣지 않는다.\n\n케이스를 입력에 적는 순간 생성기는 발굴하지 않고 받아쓴다. 그래서 intake 대화에서도 “경계값을 무엇으로 넣을까요”를 묻지 않는다. 대신 정책의 빈칸을 묻는다. 7일째는 무료인지, 8일부터 과금인지. MANUAL 지정과 7일 무료가 충돌하면 무엇이 우선인지. 외부 의존은 무엇인지.\n\n구조는 이렇게 잡았다.\n\n```text\n정책(자연어)\n  └─ intake → input.json(정책만)\n\nGen → Critique → Eval\n │        │        │\n └──── Refine ←────┘   최대 3회\n\n매 단계 Validate\n```\n\n판정은 세 겹으로 뒀다.\n\n| 게이트 | 맡은 일 | 그렇게 둔 이유 |\n| --- | --- | --- |\n| 스키마 | input, gen 산출, final, eval의 형식을 닫는다 | 산출물이 역할 밖의 말을 섞지 못하게 한다 |\n| 금지패턴 | “정상적으로 동작”, “문제없이”, “적당히” 같은 검증 불가능한 단언을 잡는다 | 모호한 문장이 통과 문장처럼 보이는 일을 막는다 |\n| 루브릭 임계 | coverage, unambiguity, behavioral_altitude, independence를 축별로 채점한다 | 총점 평균으로 약한 축을 덮지 못하게 한다 |\n\n루브릭은 contract:v1로 두고, 가중치는 coverage .30, unambiguity .30, behavioral_altitude .20, independence .20으로 잡았다. 총점은 4.3 이상이어야 하고, 축별 하한도 따로 뒀다. coverage와 unambiguity는 4.0, behavioral_altitude와 independence는 3.5다.\n\n축별 하한이 핵심이었다. 총점만 있으면 한 축이 무너져도 다른 축이 떠받친다. 그러면 “평균적으로 괜찮은” 산출물이 통과한다. 하지만 명세에서 한 축이 무너지면 평균은 별 의미가 없다.\n\n역할도 분리했다. Gen은 eval과 critique를 보지 못한다. Critique는 eval 점수와 validator 판정을 보지 못한다. Eval은 critique를 보지 못한다. Refine은 eval 원문과 weighted_total을 보지 못한다.\n\nEval이 판정문이나 수정 지시, 고쳐 쓴 본문을 출력하면 스키마가 거부한다. 채점자와 수정자가 붙어 있으면 수정자는 점수를 맞추는 쪽으로 움직인다. 코드가 정책에 맞춰지는 것이 아니라, 산출물이 채점자를 닮아간다.\n\n## 바로 생성하면 명세가 아니라 배관이 나온다\n\n여기까지 만들고 나서야 더 근본적인 문제가 보였다. 테스트를 자동으로 만드는 일이 곧 명세를 자동으로 만드는 일은 아니었다.\n\n코드로 쓴 테스트는 클래스명, 메서드명, setter, 주입받는 포트 타입에 묶인다. 그 이름들은 설계가 자라면서 바뀐다. 구현 전에 TDD 순서로 쓰면 아직 존재하지 않는 구체를 미리 못 박게 된다.\n\n한 파일 안에 수명이 다른 두 가지가 섞여 있었다. 오래 사는 것은 “무엇이 참이어야 하는가”라는 단언이다. 금방 죽는 것은 “그걸 어떻게 호출해서 확인하는가”라는 배관이다.\n\n이 둘을 가르지 않고 통째로 자동화하면 명세가 아니라 곧 깨질 배관을 빠르게 만든다.\n\n## 이름은 바뀌었고, 단언은 그대로였다\n\n환불 도메인을 TDD로 13사이클 돌린 로그가 있다. 사이클 8에서 `RefundPolicy`를 `RefundCalculator`로 바꿨다. 기존 이름은 정책 판정만 하는 것처럼 들렸지만, 실제 진입점은 최종 환불 금액을 반환하고 있었다.\n\n이 리네임 하나로 파일, 클래스, 테스트 파일, 테스트 내부 호출이 전부 바뀌었다. 그런데 단언 값은 하나도 바뀌지 않았다. 6개 테스트도 그대로 통과했다.\n\n사이클 7도 같은 모양이었다. 정책 판정 책임을 새 클래스로 분리하면서 테스트를 `ProrationTest`에서 `RefundPolicyTest`로 옮겼다. 옮겨간 것은 호출 지점과 이름이었다. 단언 값은 그대로였고, 6개 모두 통과했다.\n\n두 번의 로그가 같은 말을 하고 있었다. 바뀐 것은 배관이고, 살아남은 것은 단언이었다.\n\n비슷한 일이 행위 명세에서도 있었다. `.feature` 파일은 멀쩡했는데, 그 문장을 코드에 잇는 step 정의가 컴파일 단계에서 깨졌다. glue가 `setReserved` 같은 내부 setter에 의존하고 있었기 때문이다.\n\n셋업을 setter 호출에서 유스케이스 호출로 바꾸자 그 케이스는 깨지지 않았다. 명세가 죽은 것이 아니라 명세를 코드에 잇는 부분이 죽은 것이다.\n\n생성 계약에서도 같은 방향의 미끄러짐이 보였다.\n\n```gherkin\nAnd 환불 유형은 FULL이다\nAnd 주문 상태는 REFUNDED가 된다\nAnd 환불 상태는 REQUESTED를 거쳐 SUCCEEDED가 된다\n```\n\n`FULL`, `REQUESTED`, `SUCCEEDED`는 정책을 말하는 사람이 쓰는 말이라기보다 코드에 박힌 상태값에 가깝다. 손으로 쓴 문장은 같은 내용을 “전액 환불”, “부분 환불됨”처럼 도메인 언어로 적었다.\n\nEval도 이 문제를 완전히 놓치지는 않았다. behavioral_altitude를 만점이 아닌 4.0으로 깎았다. 하지만 축 하한은 3.5였고, 산출물은 통과했다. 고도를 재기는 했지만, 재고도 통과시키는 수준이었다.\n\n반대로 기계가 나은 지점도 분명했다. 정책만 담은 얇은 입력에서 주문 애그리게이트, 환불 가능 금액 한도, 환불 유형 판정, 누적 환불, PG 취소 결과 전이까지 세웠다. 손으로 쓸 때 나는 `calculate(price, totalDays, elapsedDays)`처럼 정수 세 개로 좁게 봉인했었다.\n\nUTC 시분초를 잘라내고 날짜만으로 7일 무료 경계를 판정하는 케이스도 기계가 만들었다. 나는 경과일을 정수로 넘겼기 때문에 그 경계가 존재하지 않았다.\n\n하지만 생성물에는 앱스토어와 구글플레이로 결제된 주문을 이 경로로 환불할 수 없다는 거절 시나리오가 없었다. 입력에 없었기 때문이다.\n\n여기서 판단이 갈렸다. 고도는 사람이 더 잘 붙잡고, 커버리지는 기계가 더 넓게 훑는다.\n\n## 수명으로 갈랐다\n\n대안은 세 가지였다.\n\n| 안 | 내용 | 판단 |\n| --- | --- | --- |\n| 단위 테스트를 생성해 명세로 쓴다 | 기계가 코드 테스트를 만들고 그 테스트를 기준으로 삼는다 | 기각. 이름 하나에 심판이 통째로 흔들렸다 |\n| 전부 손으로 쓴다 | 자동화를 포기한다 | 기각. 기계가 찾은 경계와 조합을 버리는 비용이 컸다 |\n| 수명으로 가른다 | 계약은 사람이 승인해 동결하고, 단위는 재생성 가능한 비계로 둔다 | 채택 |\n\n단위 테스트를 명세로 쓰는 안은 리네임 로그가 반증했다. 이름 하나를 바꿨을 뿐인데 파일과 호출이 전부 흔들렸다. 단언은 그대로였지만 심판의 몸은 갈아엎어졌다.\n\n전부 손으로 쓰는 안도 버렸다. 정책만 넣었을 때 기계는 내가 보지 못한 날짜 경계와 환불 흐름의 조합을 만들었다. 속도만의 문제가 아니었다. 내가 닫아버린 모델 안에서는 어떤 경계는 애초에 태어나지 않는다.\n\n생성기가 만든 테스트로 그 생성기의 산출물을 판정하는 구조도 버렸다. 그 구조에서는 심판이 곧 최적화 목표가 된다. 코드는 명세에 맞춰지는 것이 아니라, 명세가 코드 쪽으로 접힌다.\n\n그래서 산출물을 수명으로 나눴다. 계약은 Gherkin으로 쓰고, 도메인 언어를 유지하며, 사람이 승인한 뒤 읽기전용으로 잠근다. 자동 PASS만으로는 동결하지 않는다. 사람이 y/n으로 확인한 뒤에야 그 아티팩트를 제자리에 고정한다.\n\n단위 테스트는 다르게 둔다. 재생성 가능한 비계다. 설계가 바뀌면 다시 만들 수 있다. 대신 단위 스트림은 동결된 계약을 `frozen_contract`로 받아 그 안에서 움직인다.\n\n계약은 안정 게이트이고, 단위는 유동 비계다. 수명이 다르면 같은 파이프에 태우지 않는다.\n\n리뷰에서 받은 질문도 규칙으로 옮겼다. 내부 메서드 호출로 상태를 확인하지 말고, 바깥에서 관측 가능한 반환값이나 외부 시스템으로 나가는 최종 메시지로 단언할 수 있는지 보라는 질문이었다. 이 질문을 behavioral_altitude 축으로 올렸다. 구현 세부가 노출되면 최대 3점이라는 상한도 박았다.\n\n감상으로 남기면 다음 실행에서 사라진다. 축과 상한으로 넣으면 매 회차 다시 걸린다.\n\n## 동결한 명세는 심판이 되었나\n\n계약 스트림은 2회차에 통과했다. 단위 스트림은 3회차에 통과했다. 점수는 계약 4.3/5, 단위 4.675/5였다.\n\n계약 점수 4.3은 여유 있는 합격이 아니었다. 합격선이 정확히 4.3이었다. 단위도 허용된 마지막 회차에서야 통과했다. 한 번만 더 실패했으면 산출물이 아니라 실패 아티팩트가 남았을 것이다.\n\n그 다음 확인은 구현을 갈아엎어도 명세가 심판으로 남는지였다. 같은 환불 도메인의 구현을 AI에게 통째로 새로 짜게 맡겼고, 내가 쓴 feature 18개 시나리오로만 판정했다.\n\n결과는 16개 통과, 2개 실패였다. 실패한 둘은 앱스토어와 구글플레이 결제 주문의 환불 거절이었다. 새 구현에는 결제 플랫폼 개념 자체가 없었다. 규칙 하나가 통째로 빠진 것이다.\n\n같은 코드에 대한 AI 자기 평가는 Medium 3건, Low 1건이었다. 실제로 실패한 그 2건은 한 줄도 언급하지 못했다.\n\n구현이 통째로 바뀌어도 도메인 언어로 쓴 명세는 그대로 판정했다. 반면 같은 코드에 대해 매번 같은 실패를 잡지 못하는 평가는 게이트가 되기 어려웠다.\n\n변경의 흔적을 놓고 보면 차이는 더 선명하다.\n\n| 변경 | 명세 | 배관 |\n| --- | --- | --- |\n| 클래스 이름 리네임 | 0줄 | 파일, 클래스, 호출 전부 수정 |\n| setter 제거 | 0줄 | 컴파일 단계에서 깨짐 |\n| AI가 구현 전체 재작성 | 0줄 | 전량 폐기 또는 재작성 |\n\n## 어떤 경우에 적합한가\n\n이 구조는 “AI가 만든 코드를 다시 AI에게 물어보는 것”만으로는 부족한 경우에 맞다. 특히 정책은 오래 살고 구현 구조는 자주 바뀌는 코드에서 의미가 있다.\n\n예를 들어 환불 규칙에서 “7일 무료 경계”, “누적 환불 금액 한도”, “외부 결제 취소 결과에 따른 상태 전이”는 정책에 가깝다. 반면 `RefundPolicy`라는 이름, setter를 쓸지 유스케이스를 호출할지, 어떤 포트 타입을 주입받을지는 배관에 가깝다.\n\n앞의 것이 바뀌면 계약을 다시 봐야 한다. 뒤의 것이 바뀌었는데 계약까지 흔들린다면 명세와 배관이 아직 섞여 있는 것이다.\n\n## 아직 못 닫은 지점\n\n명세는 있는 것만 지킨다. 앱 결제 주문을 이 경로로 환불할 수 없다는 거절 규칙은 입력에 없었고, 그래서 생성된 계약에도 없었다. 게이트는 자기가 모르는 규칙의 부재를 알려주지 못한다. 지금 그 구멍을 잡는 장치는 사람이 계약을 읽는 승인 단계다.\n\n명세를 코드에 잇는 부분도 완전히 자유롭지 않다. 셋업을 내부 setter에서 유스케이스 호출로 바꾸며 한 겹은 벗겼다. 하지만 glue는 아직 주입받는 포트 타입 이름에 묶여 있다. 포트를 개명하면 다시 깨질 수 있다.\n\n루브릭도 조심해야 한다. 지금 자동 신호는 LLM이 매긴 축 점수와 critique 반복이다. 점수만 보고 고치면 채점자가 곧 목표가 된다. 루브릭을 바꾸면 before/after 비교도 흔들린다.\n\n그래서 임시 원칙을 뒀다. 점수가 낮다는 사실은 루브릭을 고칠 근거가 아니다. 루브릭이 사람 판정과 어긋날 때만 고칠 수 있다. 이를 확인하려면 사람 판정이 붙은 과거 산출물을 얼려둔 캘리브레이션 셋이 필요하고, 아직 만들지 못했다.\n\n이 한계들은 닫힌 척하지 않는 편이 낫다. 그래야 다음 실험의 기준이 생긴다. AI가 짠 코드를 통과시키는 문제는 더 똑똑한 한 번의 평가를 찾는 문제가 아니라, 오래 살아야 할 말과 곧 바뀔 배관을 분리해 어디에 사람의 승인을 둘지 정하는 문제에 가깝다.",
  "generated_at": "2026-08-21T09:40:28+09:00",
  "model": "gpt-5.5",
  "metadata": {
    "prompt_version": "gen_system:v1",
    "source_files": [
      "325f4859_input.json"
    ],
    "token_usage": {
      "input_tokens": 30711,
      "cached_input_tokens": 20864,
      "output_tokens": 4119,
      "reasoning_output_tokens": 516
    }
  }
}
