{
  "brief_hash": "eb9088b6",
  "iteration": "001",
  "stage": "gen",
  "content": "# 테스트 자동화에서 무엇을 자동화해야 할까?\n\n요구사항을 넣으면 기계가 테스트를 뽑고, 그 테스트가 그대로 명세가 되는 그림을 먼저 그렸다. 그런데 몇 번 돌려 보니 깨지는 것은 행위가 아니라 이름과 호출 방식이었고, 통과하는 것은 코드가 아니라 내가 어디까지를 명세라고 부를 수 있는지였다.\n\n지금 돌리고 있는 하네스는 자연어 정책을 실행 가능한 명세로 고정하기 위한 것이다. 입력에는 정책만 넣는다. 테스트 케이스는 넣지 않는다. 입력에 “7일차, 8일차, 수동 지정, 외부 의존” 같은 케이스를 적는 순간 생성기는 발굴자가 아니라 받아쓰기 도구가 된다.\n\n그래서 intake 단계에서도 경계값을 묻지 않는다. 대신 정책의 빈칸을 묻는다. 딱 7일째는 무료인지, 8일부터 유료인지. `MANUAL` 지정과 7일 무료 규칙이 충돌하면 무엇이 우선인지. 외부 의존은 어디까지인지. 이 차이가 작아 보였지만, 뒤에서 전체 구조를 갈랐다.\n\n```\n정책\n  -> intake: 정책의 빈칸만 확인\n  -> Gen: 테스트 후보 생성\n  -> Critique: 누락, 모호한 Then, Mock 남용 검토\n  -> Eval: 루브릭 채점\n  -> Refine: 최대 3회 수정\n\n각 단계마다 Validate:\n  스키마 / 역할 경계 / 모호 단언 패턴\n```\n\n판정은 세 겹으로 뒀다. 스키마는 산출물의 형식을 막는다. 금지패턴은 “정상적으로 동작”, “문제없이”, “적당히”처럼 검증할 수 없는 단언을 잡는다. 루브릭은 coverage, unambiguity, behavioral_altitude, independence 네 축으로 본다.\n\n중요한 것은 총점만 보지 않는다는 점이었다. `min_total`은 4.3이지만, coverage와 unambiguity는 4.0, behavioral_altitude와 independence는 3.5라는 축별 하한을 따로 뒀다. 총점만 두면 한 축이 무너져도 다른 축이 떠받쳐 통과한다. 축별 하한이 있어야 평균으로 때울 수 없다.\n\n역할도 갈랐다. Gen은 critique와 eval을 보지 못한다. Critique는 eval 점수와 validator 판정을 보지 못한다. Eval은 critique를 보지 못한다. Refine은 eval 원문과 weighted_total을 보지 못한다. eval이 판정문, 수정 지시, 고쳐 쓴 본문을 내면 스키마가 거부한다. 고치는 쪽이 점수를 보면, 다음 산출물은 행위를 더 잘 설명하는 대신 점수를 잘 맞추는 쪽으로 움직인다.\n\n## 처음 틀린 그림\n\n처음에는 테스트 자동화의 목표를 “테스트 코드를 자동으로 만드는 것”으로 잡았다. 요구사항을 넣고, 기계가 단위 테스트를 만들고, 그 단위 테스트를 기준으로 구현을 맞추면 된다고 생각했다.\n\n그때 걸린 질문은 두 개였다. 꼭 코드로 써야 하나. 그리고 구현 전에 써야 하나.\n\n코드로 쓴 테스트는 클래스명, 메서드명, setter, 주입받는 포트 타입에 묶인다. 이 이름들은 설계가 자라면서 계속 바뀐다. 구현 전에 그 이름을 테스트로 고정하면, 나중에 더 나은 이름을 찾아도 테스트가 먼저 저항한다.\n\n결국 한 파일 안에 서로 다른 수명을 가진 것이 섞여 있었다. 오래 사는 것은 “무엇이 참이어야 하는가”라는 단언이다. 금방 죽는 것은 “그걸 어떻게 호출해서 확인하는가”라는 배관이다. 둘을 가르지 않고 통째로 자동화하면 명세가 생기는 것이 아니라 곧 깨질 배관이 빠르게 늘어난다.\n\n그래서 문제를 다시 썼다. 자동화할 대상은 테스트 코드 생성이 아니라, 명세와 배관을 가르는 일이다.\n\n## 바뀐 것은 이름이고 남은 것은 단언이었다\n\n환불 도메인을 TDD로 13사이클 돌린 로그가 있다. 사이클 8에서 `RefundPolicy`를 `RefundCalculator`로 바꿨다. 기존 이름은 정책을 판정하는 객체처럼 들렸지만, 실제 책임은 최종 환불 금액을 반환하는 진입점에 가까웠다.\n\n리네임 하나에 파일, 클래스, 테스트 파일, 테스트 내부 호출이 전부 바뀌었다. 그런데 단언 값은 하나도 바뀌지 않았고 6개 테스트는 그대로 통과했다.\n\n사이클 7도 비슷했다. 정책 판정 책임을 새 클래스로 분리하면서 테스트를 `ProrationTest`에서 `RefundPolicyTest`로 옮겼다. 옮긴 것은 연결부였고, 단언은 그대로였다. 역시 6개 모두 통과했다.\n\n이 두 번의 변경은 같은 말을 하고 있었다. 바뀐 것은 배관이고, 남은 것은 명세였다. 테스트 파일 하나로 보면 전부 변경처럼 보이지만, 수명으로 보면 절반은 죽고 절반은 살아 있었다.\n\n## 명세 파일은 멀쩡했지만 glue는 깨졌다\n\n다른 파이프라인에서도 같은 모양을 봤다. 행위 명세인 `.feature` 파일은 멀쩡했다. 깨진 것은 그 문장을 코드에 잇는 step 정의였다. glue가 `setReserved` 같은 내부 setter에 의존하고 있어서, setter를 없애는 리팩토링에 컴파일 단계부터 깨졌다.\n\n셋업을 내부 setter 호출에서 유스케이스 호출로 바꾸자 그 케이스는 깨지지 않았다. 사용자가 관측할 수 있는 입구에 가까워질수록 테스트는 오래 살았고, 내부 상태를 직접 만질수록 빨리 죽었다.\n\n이때 얻은 기준은 단순했다. 계약에 적을 단언은 코드 내부 메서드 호출이 아니라 반환값이나 외부 시스템으로 나가는 최종 메시지처럼 바깥에서 관측 가능한 것이어야 한다. 이 기준을 감상으로 남기면 다음 실행에서 사라진다. 그래서 behavioral_altitude 축에 넣고, 구현 세부가 노출되면 최대 3점이라는 상한을 명시했다.\n\n## 기계는 넓게 보지만 낮게 미끄러진다\n\n생성기가 만든 계약에는 이런 식의 문장이 섞였다.\n\n```gherkin\nAnd 환불 유형은 FULL이다\nAnd 주문 상태는 REFUNDED가 된다\nAnd 환불 상태는 REQUESTED를 거쳐 SUCCEEDED가 된다\n```\n\n`FULL`, `REQUESTED`, `SUCCEEDED`는 정책을 쓰는 사람이 먼저 말하는 단어라기보다 코드에 정의된 상태값에 가깝다. 내가 손으로 쓴 문장은 같은 내용을 “전액 환불”, “부분 환불됨”처럼 도메인 언어로 적었다.\n\neval도 이 문제를 잡았다. behavioral_altitude를 만점으로 주지 않고 4.0으로 깎았다. 문제는 그래도 통과했다는 점이다. 이 축의 하한은 3.5였기 때문이다. 기계가 고도를 재는 것까지는 했지만, 재고도 통과시키는 수준이었다.\n\n반대로 커버리지는 기계가 나았다. 정책만 적은 얇은 입력에서 주문 애그리게이트, 환불 가능 금액 한도, 환불 유형 판정, 누적 환불, PG 취소 결과 전이까지 스스로 세웠다. 내가 손으로 쓸 때는 환불 계산을 `calculate(price, totalDays, elapsedDays)`처럼 정수 세 개로 좁게 봉인했다.\n\n내가 보지 못한 경계도 있었다. UTC 시분초를 잘라내고 날짜만으로 7일 무료 경계를 판정하는 케이스다. 나는 경과일을 정수로 넘겼기 때문에 애초에 그 경계가 존재하지 않았다.\n\n하지만 반대편도 있었다. 내가 손으로 쓴 feature에는 앱스토어와 구글플레이로 결제된 주문을 이 경로로 환불할 수 없다는 거절 시나리오가 네 개 있었다. 요구사항에 처음부터 적혀 있던 내용은 아니었다. 시나리오를 짜 내려가다 중간에 떠오른 규칙이었다. 생성물에는 이 규칙이 없었다. 입력에 없었기 때문이다.\n\n여기서 결론은 “기계가 낫다”도 “사람이 낫다”도 아니었다. 고도는 사람이 낫고, 커버리지는 기계가 낫다. 둘을 같은 역할에 세우면 어느 한쪽의 장점이 다른 쪽의 약점을 가린다.\n\n## 기각한 선택들\n\n| 안 | 내용 | 판단 |\n| --- | --- | --- |\n| 단위 테스트를 생성해 명세로 쓴다 | 기계가 코드 테스트를 만들고 그걸 기준으로 삼는다 | 기각. 이름 하나를 바꾸면 심판이 통째로 흔들린다. |\n| 전부 손으로 쓴다 | 자동화를 포기한다 | 기각. 기계가 찾아낸 경계와 넓이를 버리는 대가가 크다. |\n| 수명으로 가른다 | 계약은 사람이 소유하고, 단위는 재생성 가능한 비계로 둔다 | 채택. |\n\n단위 테스트를 명세로 쓰는 안은 리네임 사이클에서 이미 반증됐다. 심판이 클래스명과 호출 방식에 묶여 있으면, 행위가 보존돼도 심판이 흔들린다.\n\n전부 손으로 쓰는 안도 버렸다. 속도 때문만은 아니다. 내가 보지 못한 날짜 경계처럼, 사람의 시야 밖에 있는 조합을 기계가 꺼내는 경우가 있었다. 자동화를 포기하면 그 경계를 영영 못 볼 가능성이 있다.\n\n생성기가 만든 테스트로 그 생성기의 산출물을 판정하는 구조도 기각했다. 이 구조에서는 심판이 곧 최적화 목표가 된다. 코드가 명세에 맞춰지는 것이 아니라, 명세가 코드에 맞춰진다. 게이트라고 부르기 어렵다.\n\n## 계약은 동결하고 단위는 다시 만든다\n\n그래서 토폴로지를 두 스트림으로 나눴다. 먼저 계약 run을 통과시킨다. 계약은 Gherkin으로 쓴다. 자동 PASS만으로는 동결하지 않는다. 사람이 보고 `y/n`으로 승인한 뒤에야 그 아티팩트를 제자리에서 읽기전용으로 잠근다. 실제로는 `chmod a-w`로 쓴다.\n\n그 동결된 원문을 `frozen_contract`로 실어 단위 run이 제약으로 받는다. 계약은 사람이 소유하는 안정 게이트다. 단위 테스트는 재생성 가능한 유동 비계다. 수명이 다르면 같은 파이프에 태우지 않는다.\n\n이 구조에서는 설계가 바뀌었을 때 단위 스트림만 다시 돌릴 수 있다. 계약은 그대로 남아 행위가 보존됐는지 본다. 클래스 이름을 바꾸거나 구현을 새로 짜도, 도메인 언어로 쓴 계약이 흔들리지 않으면 변경은 배관 쪽에서 처리할 수 있다.\n\n각 회차의 `eval.json`과 `critique.json`도 단순 로그로 두지 않았다. 축 점수, 근거, 루브릭 이름, 가중 총점, 비평은 다음 층의 입력이 된다. 다만 누가 무엇을 볼 수 있는지는 앞에서 말한 역할 경계로 막았다.\n\n미검토 run이 5개 쌓이면 파이프라인 자신을 고치는 제안, 즉 느린 루프를 돌릴지 묻는다. 제안은 기계가 할 수 있지만 적용은 사람이 한다. 루브릭 변경 제안에는 “위험 높음”과 “효과 검증 장치 없음”이라는 라벨을 붙인다. 점수가 낮다는 것은 루브릭을 고칠 근거가 못 된다.\n\n느린 루프 자신의 판정 장치도 제안 대상에서 제외했다. 제안용 루브릭, 프롬프트, 집계 코드는 스스로 고칠 수 없다. 자기 심판을 자기가 고치는 경로를 열어두면, 개선처럼 보이는 것이 기준 이동일 수 있다.\n\n## 검증에서 남은 숫자\n\n계약 스트림은 2회차에 통과했다. 단위 스트림은 3회차에 통과했다. 점수는 계약 4.3/5, 단위 4.675/5였다.\n\n이 숫자는 넉넉한 성공이 아니었다. 계약의 합격선이 정확히 4.3이었다. 합격선에 붙어서 넘어갔다. 단위는 점수에 여유가 있었지만 허용된 마지막 회차인 3회차에서야 통과했다. 한 회차만 더 실패했으면 산출물이 아니라 실패 아티팩트가 남았다.\n\n동결한 명세가 실제 심판이 되는지도 따로 봤다. 같은 환불 도메인의 구현을 AI에게 통째로 새로 짜게 맡긴 뒤, 내가 쓴 18개 시나리오로만 판정했다. 16개가 통과했고 2개가 실패했다. 실패한 둘은 앱스토어와 구글플레이 결제 주문의 환불 거절이었다. 원인은 그 구현에 결제 플랫폼 개념 자체가 없었다는 점이었다.\n\n같은 코드에 대한 AI 자기 평가는 Medium 3건, Low 1건을 냈다. 실제로 실패한 그 2건은 한 줄도 언급하지 못했다. 구현이 통째로 바뀌어도 도메인 언어로 쓴 명세는 심판으로 남았지만, 같은 코드에 대해 늘 같은 실패를 짚지 못하는 평가는 판정자로 쓰기 어려웠다.\n\n변경을 수명으로 놓고 보면 차이는 더 분명했다.\n\n| 변경 | 명세 | 배관 |\n| --- | --- | --- |\n| 클래스 이름 리네임 | 0줄 | 파일, 클래스, 호출 전부 수정 |\n| setter 제거 | 0줄 | step 정의가 컴파일부터 깨짐 |\n| 구현 전체 재작성 | 0줄 | 전량 폐기하고 다시 작성 |\n\n## 어떤 경우에 적합한가\n\n이 구조는 테스트가 설계 이름과 호출 방식 때문에 자주 깨지는 경우에 맞다. 특히 행위는 유지되는데 테스트 파일만 계속 바뀐다면, 그 테스트 안에 오래 사는 단언과 짧게 사는 배관이 섞여 있을 가능성이 높다.\n\n예를 들어 결제 취소 기능에서 “취소 가능한 금액을 넘으면 거절한다”는 규칙은 오래 산다. 하지만 그 규칙을 확인하기 위해 `PaymentPort`, `CancelService`, `setApprovedAmount` 중 무엇을 호출하는지는 설계가 바뀌면 같이 바뀐다. 이 둘을 같은 산출물로 동결하면, 리팩토링할 때마다 명세를 고치는 것처럼 보인다.\n\n반대로 정책 자체가 자주 바뀌고, 아직 사람이 승인할 안정된 문장도 없다면 이 구조는 무거울 수 있다. 계약을 동결하는 순간 그 아래 작업은 빨라지지만, 틀린 계약을 동결하면 틀린 기준이 안정적으로 작동한다.\n\n## 아직 닫지 못한 지점\n\n첫째, 명세는 있는 것만 지킨다. 앱 결제 주문을 이 경로로 환불할 수 없다는 거절 규칙은 입력에 없었고, 그래서 생성된 계약에도 없었다. 게이트는 자기가 모르는 규칙의 부재를 알려주지 못한다. 지금 이 구멍은 사람이 계약을 읽고 승인하는 단계에서만 잡힌다.\n\n둘째, 명세를 코드에 잇는 부분은 아직 포트 타입 이름에 묶여 있다. 셋업을 내부 setter에서 유스케이스 호출로 바꿔 한 겹은 벗겼지만, 포트를 개명하면 glue는 여전히 깨진다. 배관의 수명을 늘렸을 뿐, 없앤 것은 아니다.\n\n셋째, 자동 신호는 아직 채점 점수와 비평 반복에 기대고 있다. 점수만 보고 고치면 채점자가 곧 목표가 된다. 루브릭을 바꾸면 before/after 비교도 깨진다. 나아졌는지 잴 잣대가 사라지기 때문이다.\n\n그래서 임시 규칙을 세웠다. 점수가 낮다는 것은 루브릭을 고칠 근거가 아니다. 루브릭이 사람 판정과 어긋난다는 것만 근거가 된다. 이를 확인하려면 사람 판정이 붙은 과거 산출물을 얼려둔 캘리브레이션 셋이 필요하다. 아직 만들지 못했다.\n\n이 판단은 테스트를 덜 중요하게 보자는 쪽이 아니다. 오히려 어떤 테스트가 오래 살아야 하는지, 어떤 테스트는 다시 만들어도 되는지를 분리하자는 쪽에 가깝다. 명세와 배관을 같은 파일에 넣을 수는 있다. 하지만 같은 수명을 가진 것처럼 다루는 순간, 리팩토링은 행위를 바꾸지 않아도 명세를 흔드는 일이 된다.\n\n지금 남은 다음 실험은 배관을 얼마나 더 바깥 관측에 붙일 수 있는지 보는 것이다. 모든 것을 자동으로 만들 수 있다는 쪽으로 가지 않는다. 사람이 고도를 잡고, 기계가 빠뜨린 조합을 들추고, 동결된 계약이 둘 사이의 기준으로 남는 구조가 지금까지는 가장 덜 흔들렸다.",
  "generated_at": "2026-08-21T09:10:42+09:00",
  "model": "gpt-5.5",
  "metadata": {
    "prompt_version": "gen_system:v1",
    "source_files": [
      "eb9088b6_input.json"
    ],
    "token_usage": {
      "input_tokens": 30166,
      "cached_input_tokens": 2432,
      "output_tokens": 4584,
      "reasoning_output_tokens": 500
    }
  }
}
