{
  "brief_hash": "310164c7",
  "iteration": "003",
  "stage": "refine",
  "content": "# 더 넘기려면 내가 남을 자리를 먼저 정해야 했다\n\n더 많이 AI에게 넘기려면, 오히려 내가 물러서지 않을 자리를 먼저 세워야 했다. 결제 기능을 붙이던 때 코드가 1000줄, 2000줄로 불어났고, 그 앞에서 내 인상은 이미 신뢰를 잃고 있었다.\n\n그때 없던 것은 지식이 아니었다. 이 코드가 괜찮은지 아닌지 말할 근거였다. 그래서 결론을 먼저 정하지 않고, 사람이 하던 일을 한 칸씩 실제로 밀어봤다.\n\n## 처음에는 시키는 일만 넘어갔다\n\n처음에는 정말 도구로 썼다. 물어보고, 코드를 작성해달라고 하고, 검토해달라고 했다. 같은 지시를 다시 붙여 넣고, 큰 일을 작은 조각으로 나눠 맡겼다.\n\n이때 넘어간 것은 타이핑과 초안 작성에 가까웠다. 무엇을 시킬지, 어디까지가 충분한지, 어느 응답을 버릴지는 내가 정했다. AI는 손을 늘려줬지만, 일의 모양을 정하지는 않았다.\n\n작업이 조각나니 맥락이 끊겼고, 같은 말을 반복해서 쓰는 일도 생겼다. 도구로는 쓸 수 있었지만, 내가 어디에서 멈춰야 하는지까지 알려주지는 않았다.\n\n## 같은 답이 나오는 일만 통째로 넘겼다\n\n다음에는 판단을 넘길 수 있는지 봤다. 그냥 물어보면 같은 코드에도 매번 다른 답이 왔다. 어떤 때는 심각도가 낮다고 하고, 어떤 때는 높다고 했다.\n\n구독 서비스의 환불 정책을 두고 실험했다. 결제 후 7일 이내 전액 환불, 8일째부터 남은 기간 계산, 이미 환불된 주문 거절, 앱스토어와 구글플레이 결제는 이 경로로 환불 불가 같은 규칙 열 개 남짓이었다.\n\n먼저 사람이 읽는 시나리오 18개를 썼다. 사람이 읽을 수 있는 문장이지만, 기계가 그대로 실행해서 통과와 실패를 낼 수 있게 했다. 그다음 AI에게 구현 전체를 새로 짜게 했다.\n\n시나리오 18개를 실행하자 16개가 통과했고 2개가 실패했다. 실패한 둘은 앱스토어와 구글플레이 결제 주문을 거절하지 못한 경우였다. AI가 짠 코드에는 결제 플랫폼이라는 개념 자체가 없었다.\n\n같은 코드를 AI에게 보여주고 평가하게 하자 중간 심각도 3건, 낮은 심각도 1건을 말했다. 전부 말이 됐다. 하지만 실제로 실패한 2건은 한 줄도 언급하지 못했다.\n\n여기서 갈린 것은 옳고 그름이 아니라 재현되느냐였다. 시나리오는 몇 번을 돌려도 같은 2개를 짚는다. AI에게 다시 물으면 다른 것을 짚는다. 이 칸에서 넘어간 것은 반복 실행으로 확인되는 판정이었고, 남은 것은 글이나 설계처럼 같은 답으로 떨어지지 않는 판단이었다.\n\n## 점수가 같은 글도 다르게 보았다\n\n그래서 판단을 세 칸으로 나눴다.\n\n| 종류 | 같은 입력에 같은 답이 나오는가 | 맡기는 방식 | 실제 예 |\n| --- | --- | --- | --- |\n| 완전히 결정적 | 나온다 | 기계에 통째로 넘긴다 | 정해진 형식, 금지 표현, 시나리오 통과 여부 |\n| 숫자는 나오지만 흔들림 | 숫자는 나오지만 흔들린다 | AI가 내되 사람이 소유한다 | AI가 매기는 점수 |\n| 숫자도 안 나옴 | 안 나온다 | 사람이 정한다 | 승인 여부, 무엇을 옳다고 볼지 |\n\n첫 칸은 기계가 대조만 하면 된다. 정해진 형식을 지켰는지, 본문에 나오면 안 되는 표현이 나왔는지, 시나리오가 통과하는지처럼 같은 입력에 같은 답이 나오는 일이다.\n\n둘째 칸은 위험했다. 점수가 붙어 있어서 결정적인 척하기 때문이다. 실제로 같은 내용의 같은 항목이 4점과 2.5점으로 갈렸다. 사람이 보기엔 같은 결과물인데 점수만 달라진 것이다.\n\n그래서 이 칸의 출력은 합격 도장이 아니라 신호로만 썼다. 하한으로 자르기는 하되, 진짜로 읽는 것은 점수가 아니라 왜 그 점수가 나왔는지 붙은 문장이었다.\n\n이 칸에서 넘어간 것은 점수를 내고 이유를 붙이는 일이었다. 남은 것은 그 점수를 판정으로 믿지 않는 일이었다.\n\n## 규칙으로 잡히는 것은 아래로 내렸다\n\n이 선은 고정된 것이 아니었다. 처음 만든 채점표는 항목이 다섯이었고, 서로 다른 초안 세 편에 같은 항목 점수 세 개를 똑같이 줬다. 도입도 문체도 분량도 결론도 다른 글이었다.\n\n원인은 5점 설명에 있었다. “자연스럽게 이어진다”, “단단히 받친다” 같은 좋음의 정도였다. 웬만큼 쓴 초안은 늘 그 근처를 만족했다. 다음 채점표에서는 5점 설명을 확인 가능한 요소가 있는지 없는지로 바꿨고, 항목도 여덟로 늘렸다.\n\n한번은 어떤 항목이 계속 낮게 나왔다. 명세 문서에 코드 냄새가 나는 표현이 섞였는지 보는 항목이었다. 점수 옆의 이유를 열어보니 계산식이 샌 게 아니었다. 밑줄로 이어 붙인 영문 소문자 이름과 기계용 시각 표기였다.\n\n그건 안목으로 볼 일이 아니라 문자열 규칙으로 잡을 수 있는 일이었다. 그래서 문자열을 보는 작은 검사로 내렸다. 가운데 칸에 있던 일부가 왼쪽 칸으로 내려간 것이다.\n\n이 칸에서 넘어간 것은 흔들리던 판단 일부였다. 남은 것은 아직 규칙으로 내리지 못한 판단이었다. 내려가는 만큼 그 자리에서 눈치싸움이 사라졌다.\n\n## 고쳐 쓰기는 넘어갔지만 점수는 그대로 못 믿었다\n\n그다음에는 AI가 자기 글을 스스로 고치게 했다. 점수를 매기고, 그 점수를 토대로 다시 쓰는 과정을 붙였다. 사람이 읽고 고쳐 쓰던 자리를 AI가 메꿨다.\n\n하지만 앞 단계의 한계가 그대로 따라왔다. 점수를 믿을 수 없었다. 초안이 재료에 없는 1인칭 경험과 감정을 지어낸 일이 있었다. “판정 장치를 만들면 마음이 편해질 줄 알았다”, “처음에는 빠르게 보였다” 같은 문장이었다. 전부 글을 그럴듯하게 만드는 자리에 정확히 들어갔다.\n\n채점표는 이걸 못 잡았다. 지어낸 서술이 네 건 있는 초안이 근거 항목에서 4.8을 받고, 깨끗한 초안이 4.5를 받았다. 방향이 반대였다. 구체적으로 쓰인 거짓이 모호하게 쓰인 진실보다 근거 있어 보였기 때문이다.\n\n그래서 찾아내는 일을 채점이 아니라 대조로 옮겼다. 대조는 본문의 1인칭 서술을 저자가 준 재료와 하나씩 맞춰 보는 일이다. 같은 지시로 지어낸 초안에서는 4건, 깨끗한 초안에서는 0건이 나왔다.\n\n이 칸에서 넘어간 것은 점수를 보고 다시 쓰는 일이었다. 남은 것은 점수가 놓친 거짓을 다른 방식으로 잡는 일이었다.\n\n## 고칠 곳을 제안하게 했지만 바꿀지는 남겼다\n\n결과물 하나를 만들고 검사하는 빠른 반복이 생기자, 그 실행 기록을 모아 작업 방식 자체를 고칠 제안을 만드는 느린 반복을 얹었다. 빠른 반복은 글 하나를 고치는 길이고, 느린 반복은 그 길 자체를 손보자는 제안을 만드는 길이다.\n\n```text\n빠른 반복: 결과물 생성 -> 검사 -> 고쳐쓰기\n느린 반복: 실행 기록 모음 -> 개선 제안 -> 사람 승인\n```\n\n신호를 모으는 일은 코드가 했다. 무엇을 어떻게 고칠지 제안하는 일은 AI가 했다. 실제로 바꾸는 일은 사람이 했다.\n\n낮은 점수는 어디를 고칠지 바로 말해주지 않는다. 초안 생성이 근거를 약하게 썼을 수도 있고, 고쳐쓰기가 못 살렸을 수도 있고, 기준이 잘못 맞춰졌을 수도 있고, 채점이 그 항목을 잘못 봤을 수도 있다.\n\n그래서 집계하는 코드는 고칠 대상을 정하지 않고 신호와 가능한 원인만 띄웠다. AI의 제안은 어느 문장이 원인인지, 어떤 항목을 올리려는지, 고치면 왜 올라가는지, 다른 가능성 둘은 왜 아닌지, 부작용은 무엇인지, 실제로 넣을 문장은 무엇인지까지 적어 왔다.\n\n세 건이 실제로 적용됐다. 강조하기로 한 주제를 글의 비중 중심으로 삼으라는 지시, 재료에 있는 핵심 결정과 선택 이유를 본문에서 생략하지 말라는 지시, 결론을 한계 나열로 끝내지 말라는 지시였다.\n\n이 칸에서 넘어간 것은 실행 기록을 읽고 고칠 곳을 제안하는 일이었다. 남은 것은 그 제안을 실제 기준으로 받아들일지 정하는 일이었다.\n\n## 고치는 방법까지 고치게 두지는 않았다\n\n여기서 한 칸 더 올라가는 길은 막았다. 느린 반복이 자기 채점표와 지시문과 집계 코드까지 고치게 하면 순환이 끊기지 않는다.\n\n이유는 둘이었다. 채점표가 곧 최적화 목표가 된다. 그리고 채점표를 바꾸면 그 항목의 전후 비교가 정의상 무효가 된다. 점수가 낮아서 채점표를 고쳤다고 하면, 그다음에 “고쳤더니 나아졌다”고 말할 방법이 없다. 나아졌는지 잴 자를 방금 바꿨기 때문이다.\n\n그래서 낮은 점수를 채점표를 고칠 근거로 쓰는 경로를 버렸다. 채점표가 사람 판단과 어긋난다는 것만 근거가 될 수 있다고 정했다.\n\n이 칸에서 넘어간 것은 고칠 후보를 찾는 일이었다. 남은 것은 잣대를 바꿀 자격을 정하는 일이었다. 결국 사람이 다 해야 한다는 결론도 버렸다. 앞의 여러 칸에서 넘긴 것들은 실제로 넘어갔고, 넘긴 뒤가 더 나았다.\n\n## 다른 일에서도 같은 순서가 반복됐다\n\n같은 일이 다른 곳에서도 반복됐다. 콘텐츠 자동화를 만들 때 받은 스토리보드가 빈약해서 바로 제작으로 들어갈 수 없었다. 예전 같으면 내가 먼저 보완했을 일이다.\n\n이번에는 먼저 그 스토리보드를 구체화하는 작업자를 만들었다. 그 응답을 토대로 인터뷰어와 인터뷰이를 만들어, 내가 수동으로 하던 인터뷰를 자동화했다.\n\n넘어간 것은 스토리보드 보완과 질문을 주고받으며 빈 곳을 채우는 일이었다. 남은 것은 무엇이 충분한 보완인지 승인하는 일이었다. 사람 둘이 마주 앉아 묻고 답하는 일도 쪼개 보니 같은 순서로 움직였다.\n\n아직 안 넘어간 일은 원래 못 넘기는 일이라는 생각도 버렸다. 못 넘긴다고 믿었던 게 아니라 아직 밀어보지 않은 것이었다.\n\n## 남은 일은 무엇을 옳다고 볼지로 모였다\n\n넘기고 남은 것들은 같은 곳을 가리켰다. 채점표를 쓰는 일, 점수를 믿을 근거를 만드는 일, 채점표를 바꿀지 정하는 일. 전부 무엇을 옳다고 볼지의 문제였다.\n\n빠뜨림도 둘로 갈렸다. 요구사항을 안 적은 빠뜨림은 이미 대고 있는 자 안에서 어떤 경우를 안 본 것이다. 같은 방식으로 더 많이 시험하면 결국 걸린다.\n\n하지만 잴 자 자체를 안 챙긴 빠뜨림은 다르다. 두 구현이 지금 대는 모든 자에서 똑같아 보인다. 아무리 열심히 시험해도 안 걸린다. 애초에 그 차이를 드러낼 자를 안 대고 있어서다.\n\n채점표를 바꾸는 방법은 알고 있다. 사람이 판단을 붙여둔 옛 결과물 몇 개를 얼려두고, 새 채점표로 그것들을 다시 채점한다. 그리고 사람 판단과 더 비슷하게 나오는 쪽을 고르면 된다. 얼린 결과물에 붙은 사람 판단은 채점표가 바뀌어도 움직이지 않으니 비교가 성립한다.\n\n아직 못 했다. 같은 재료로 작업 방식을 고쳐가며 뽑은 초안 아홉 편을 남겼지만 판정란이 비어 있다. 지금 통과선 4.2는 관측된 점수 분포에서 고른 값이지 사람 판정에서 역산한 값이 아니다.\n\n이 판단도 깨질 수 있다. 결정적으로 잡을 수 있는 것과 없는 것을 가르는 선이 지금 자리에 맞다는 근거는 아직 약하다. 사람 판단이 채점표보다 낫다는 전제도 확인할 장치를 못 만들었다. 이 배치 전체는 사람이 잣대를 계속 들여다볼 시간이 있을 때만 성립한다.\n\n## 성장은 더 많이 직접 하는 일이 아니었다\n\n그래서 내가 지금 서 있는 자리는 결과물을 직접 만드는 곳이 아니라, 무엇을 넘기고 무엇을 아직 쥘지 계속 다시 긋는 곳이다.\n\n성장을 다시 정의하게 됐다. 더 오래 붙잡고 있는 사람이 되는 것이 아니라, 어떤 일은 완전히 넘길 수 있는지, 어떤 일은 흉내로만 넘겨야 하는지, 어떤 일은 아직 사람이 소유해야 하는지 계속 다시 가르는 사람이 되는 것이다.\n\n이 정의에는 대가가 있다. 직접 만드는 시간은 줄어도, 잣대를 만들고 얼리고 비교하는 시간은 사라지지 않는다. 만들던 손이 비는 만큼, 승인하고 보류하고 다시 재는 시간이 일의 중심으로 올라온다.\n\n지금까지 넘긴 것은 도구처럼 시키는 일, 같은 입력에 같은 답이 나오는 검사, 점수를 보고 고쳐 쓰는 일, 실행 기록을 읽고 개선할 곳을 제안하는 일이었다. 못 넘긴 것은 무엇을 옳다고 볼지 정하는 일, 채점표를 바꿀지 승인하는 일, 사람 판단을 모아 비교의 바닥을 만드는 일이었다.\n\n다음에 할 일은 크지 않다. 비어 있는 아홉 편의 판정란을 채우고, 얼린 결과물로 새 채점표를 다시 돌려보고, 사람 판단과 더 가까워지는지 확인하는 것이다. 그다음에야 한 칸 더 올릴 수 있는지 말할 수 있다.\n\nAI에게 넘길 수 있는 것은 생각보다 많았고, 그래서 남는 자리는 더 흐릿해지지 않았다. 더 많이 넘겨본 뒤에야, 내가 물러서지 않을 자리가 조금 더 정확해졌다.",
  "generated_at": "2026-08-24T15:29:49+09:00",
  "model": "gpt-5.5",
  "metadata": {
    "prompt_version": "refine_system:v1",
    "source_files": [
      "310164c7_input.json"
    ],
    "token_usage": {
      "input_tokens": 37500,
      "cached_input_tokens": 20864,
      "output_tokens": 4089,
      "reasoning_output_tokens": 516
    }
  }
}
