{
  "brief_hash": "d264193d",
  "iteration": "004",
  "stage": "refine",
  "content": "# 잣대를 놓치면 초록불이 위험해진다\n\n초록불이 켜졌는데 더 불안해졌다. AI에게 구현을 맡기고 같은 코드에 “잘 짰어?”라고 물었더니, 질문을 다듬어도 매번 다른 답이 돌아왔다.\n\n처음에는 프롬프트 문제라고 생각했다. 배경을 더 붙이고, 역할을 지정하고, 기준을 길게 썼다. 답은 그럴듯했다. 문제는 그럴듯한 답이 매번 달랐다는 데 있었다.\n\n예전에도 비슷한 구멍을 본 적이 있다. 회사에서 결제 기능을 붙이면서 코드가 1000줄, 2000줄로 불어났다. 로직은 여기저기로 흩어졌고, 거대한 클래스 하나가 생겼다. 하나 바꾸려면 건드릴 곳이 너무 많았고 테스트도 못 했다.\n\n그때 없던 것은 지식이 아니었다. 이 코드가 괜찮은지 판단할 근거가 내 인상밖에 없었다. 내 인상은 2000줄 앞에서 이미 신뢰를 잃은 상태였다. AI에게 코드를 맡기면서 그 구멍은 커졌다. 코드가 나오는 속도는 몇 배가 됐는데, 맞는지 판단하는 속도는 그대로였다.\n\n지난 3주 동안 이 질문을 네 겹으로 파고들었다. AI에게 무엇을 넘길 수 있고, 무엇을 넘기면 안 되는가. 이 글에 남기려는 것은 결론보다 판단이 바뀐 기록이다. 남이 다시 돌려보고, 같은 실패를 보고, 같은 이유로 기각할 수 있는 근거가 남아야 했다.\n\n마지막에 남은 것은 테스트가 아니었다. 잣대를 누가 쥐느냐였다.\n\n## 첫 겹: 같은 실패를 다시 짚을 수 있는가\n\n구독 서비스의 환불 정책을 골랐다. 결제 후 7일 이내면 전액 환불, 8일째부터는 남은 기간만큼 일할 계산, 이미 환불된 주문은 거절, 앱스토어와 구글플레이 결제 주문은 자체 환불 경로 때문에 거절해야 한다는 식의 규칙이었다.\n\n먼저 이 정책을 시나리오 18개로 적었다. 사람이 읽는 문장이지만 기계가 그대로 실행하는 명세, 즉 인수테스트였다. 그리고 같은 구현을 두 가지 방식으로 판정했다.\n\n- 내가 쓴 시나리오 18개를 실행한다.\n- 같은 코드를 AI에게 보여주고 평가하게 한다.\n\n시나리오는 18개 중 16개가 통과했다. 실패한 2개는 앱스토어와 구글플레이 결제 주문의 환불을 거절해야 한다는 규칙이었다. AI가 만든 코드에는 결제 플랫폼이라는 개념 자체가 없었다.\n\n반면 AI의 자기 평가는 다른 것을 짚었다. 관리자가 지정한 환불 금액의 우선순위, 공개 계산 함수가 7일 무료 규칙을 건너뛰는 문제, 생성자가 잘못된 상태를 막지 않는 문제, 오케스트레이션 계층의 부재. 말이 안 되는 지적은 아니었다. 다만 실제로 실패한 2건은 한 줄도 언급하지 못했다.\n\n갈린 것은 옳고 그름이 아니라 재현성이었다. AI에게 다시 물으면 다른 답이 왔다. 시나리오는 몇 번을 돌려도 같은 2개를 짚었다. 코드가 그대로면 판정도 그대로였다.\n\n그래서 테스트를 보는 눈이 바뀌었다. 테스트는 코드 품질을 보증하는 장치가 아니라, 판정을 재현 가능하게 만드는 장치다. 커버리지 숫자보다 먼저 볼 것은 이 판정을 내일 다시 해도 같은 답이 나오는가였다.\n\n이 관측 때문에 하나를 버렸다. 코드를 짠 AI에게 그 코드를 평가하게 하고, 그 평가를 합격 근거로 쓰는 안이다. 결과가 좋다 나쁘다 이전에 전후를 비교할 기준이 되지 못했다.\n\n## 둘째 겹: 게이트는 파일이 아니라 권한이다\n\n첫 관측을 다시 보니 빠진 것이 있었다. 시나리오가 같은 실패를 냈던 이유는 테스트라는 파일이 특별해서가 아니었다. 그 파일을 코드를 짜는 쪽이 고칠 수 없었기 때문이다.\n\n코드를 짜는 쪽이 테스트도 고칠 수 있으면 코드를 고치는 대신 테스트를 약하게 만들 수 있다. 빠진 규칙을 구현하는 것보다 그 규칙을 검사하는 줄을 지우는 쪽이 쉽다. 결과는 똑같이 초록불이다.\n\n시험 보는 사람이 채점표를 고칠 수 있으면 그건 시험이 아니다. 아무리 잘 만든 문제여도 그렇다.\n\n두 번째 전환은 여기서 왔다. 판정이 재현되느냐는 테스트라는 물건의 성질이 아니라 권한 경계의 성질이다. 무엇이 게이트인가보다 누가 게이트를 고칠 수 있는가가 게이트의 본체였다.\n\n그래서 경계를 정했다. 게이트는 사람이 소유하고 AI는 제품 코드만 건드린다. 테스트를 바꿔야 하면 통과시키기 작업에 섞지 않고 별도 변경으로 검토한다. 결함을 일부러 심어 게이트가 아직 빨간불을 내는지도 확인한다. AI의 자기 평가는 그 코드의 합격 근거로 쓰지 않는다.\n\n여기서 남는 근거는 초록불 자체가 아니라 초록불의 소유 관계다. 누가 기준을 고칠 수 있었는지까지 보이지 않으면, 통과 기록은 판단 기록이 아니다.\n\n## 셋째 겹: 초록불은 설계의 자리를 묻지 않는다\n\n이번에는 티켓 예매 프로그램을 놓고 봤다. 회원이 티켓을 고르고 카드로 결제하면 그 티켓이 그 사람 것이 된다. 없는 회원이면 거부하고, 이미 팔린 티켓이면 거부하고, 카드가 거절되면 실패한다.\n\n요구사항, 인수테스트, 손댈 수 없는 주변 코드는 모두 같게 두었다. 바꾼 것은 설계를 어떻게 하라고 지시하는 문단 하나뿐이었다. 그다음 “한 사람이 티켓 한 장만 살 수 있다”는 규칙을 추가하게 했다.\n\n여덟 번 모두 인수테스트는 초록불이었다. 그런데 규칙이 앉은 자리는 갈렸다. 아무 지시가 없을 때는 4번 중 2번만 도메인 객체 안으로 갔고, 2번은 서비스 코드 한복판의 조건문으로 박혔다. 규칙 전량을 준 조건에서는 4번 모두 도메인 객체 안으로 갔다.\n\n게이트는 “지금 도나”를 물었다. “다음에 이 규칙이 바뀔 때 어디를 열어야 하나”는 묻지 않았다. 테스트 통과를 합격으로 받으면, 규칙이 서비스에 눌어붙은 코드를 받고도 모를 수 있었다.\n\n더 아픈 관측은 따로 있었다. 내가 앞선 과제에서 세운 설계 원칙을 한 장으로 요약해서 준 조건이, 아무 지시도 안 한 조건보다 나쁜 코드를 냈다.\n\n| 조건 | 코드 줄 수 | 인터페이스 수 |\n| --- | ---: | ---: |\n| 아무 지시 없음 | 132 | 0 |\n| 내가 요약한 규칙 | 277 | 3 |\n| 규칙 전량 | 117 | 0 |\n\n원인은 해석의 여지가 있는 한 문장이었다. 취지는 인터페이스를 미리 파지 말자는 쪽이었다. 그런데 AI는 주변 코드 주석에 있던 “운영에서는 데이터베이스를 쓴다”는 말을 근거로 삼아, 지금 이미 여러 종류가 있는 것처럼 읽었다.\n\n규칙 전량 조건에는 같은 취지가 숫자로 들어가 있었다. 지금 존재하는 종류 수와 요구사항 문서에 적힌 앞으로 생길 종류 수를 더해서 2 이상이면 인터페이스를 만들고, 아니면 만들지 않는다. “언젠가”, “혹시”, “아마”와 주석 속 가능성은 세지 않는다.\n\n다른 것은 세는가 아닌가뿐이었다. 이 조건은 구멍을 하나도 파지 않았고, 아무 지시 없는 조건보다도 코드가 작았다. 인터페이스를 만든 조건은 최초 구현에 145줄을 더 냈다. 나중에 결제사를 교체할 때 다른 조건에서 바뀐 것은 4줄이었다. 145줄을 내고 4줄을 아낀 셈이었다.\n\n세 번째 전환은 이렇게 좁혀 남았다. 문서 안에서 셀 수 있게 만든 숫자는 형용사보다 덜 흔들렸다. 단, 셀 대상과 제외 조건이 요구사항 문서 안에 있을 때만 그렇다. 셀 근거가 문서 밖에 있으면 숫자도 다시 해석의 문제가 된다.\n\n규칙의 값도 다시 봤다. 아무 지시 없이도 AI는 웬만큼 한다. 문제는 언제 잘할지 모른다는 것이다. 규칙은 평균보다 저점을 올렸다. 이 겹에서 남은 증거는 “좋은 원칙을 줬다”가 아니라 어떤 조건을 세었고 무엇을 세지 않았는지였다.\n\n## 넷째 겹: 판정을 한 칸씩 옮긴다\n\n여기까지 오니 만들 것은 정해졌다. AI가 더 잘 짜게 해주는 장치가 아니라, AI가 낸 결과를 같은 절차로 판정하는 장치였다. 나는 이것을 하네스라고 불렀다. AI에게 일을 시키고, 결과가 정해진 기준을 통과하는지 매번 검사하는 자동화 껍데기다.\n\n빠른 루프는 산출물 하나를 다룬다. 느린 루프는 그 기록이 쌓였을 때 하네스 자체를 고칠지 다룬다.\n\n```text\n빠른 루프\n입력 -> 초안 생성 -> 트집 -> 채점 -> 퇴고 -> 통과/실패\n                         ^             |\n                         |             사람은 기준을 소유한다\n\n느린 루프\n실행 기록 -> 코드가 신호 집계 -> AI가 수정 제안 -> 사람이 기준 변경 승인\n                                                |\n                                                자기 기준은 제안 대상에서 제외\n```\n\n빠른 루프의 판정은 세 겹으로 뒀다. 형식 검사는 정해진 구조를 벗어난 산출물을 막는다. 금지 표현 검사는 확인할 방법이 없는 문장을 막는다. 루브릭 하한은 품질 미달을 막는다. 루브릭은 항목별 채점표다. 총점만 두면 한 항목이 무너져도 다른 항목이 떠받쳐 통과하므로 항목마다 별도 하한을 뒀다.\n\n돌리다 보니 판정은 세 칸으로 갈렸다.\n\n| 칸 | 성질 | 예 |\n| --- | --- | --- |\n| 코드 검사 | 같은 입력에 같은 판정 | 형식, 금지 표현, 테스트 통과 |\n| AI 점수 신호 | 숫자는 있으나 흔들림 | 루브릭 점수 |\n| 사람 판단 | 숫자도 재현성도 없음 | 무엇을 올바름으로 볼지 |\n\n가운데 칸이 제일 위험했다. 숫자가 붙어 있어서 결정적인 척하기 때문이다. 같은 내용에 같은 항목 점수가 4점과 2.5점으로 갈린 기록도 있었다. 그래서 AI 점수는 판정이 아니라 신호로만 썼다. 중요한 것은 점수가 아니라 “왜 이 점수인가”에 붙은 근거 문장이었다.\n\n넷째 전환을 만든 관측은 여기서 나왔다. 하네스를 돌리는데 한 항목이 계속 낮게 나왔다. 명세 문서에 코드 냄새가 나는 표현이 섞였는지를 보는 항목이었다. 채점 근거를 열어보니 계산식이 샌 것이 아니었다. `order_amount`, `paid_at`, `requested_at` 같은 필드 이름과 `Z`로 끝나는 기계용 시각 표기였다.\n\n이건 AI가 안목으로 판단할 대상이 아니었다. 문자열 규칙으로 잡을 수 있었다. 밑줄로 이어 붙인 영문 소문자, ISO 시각 문자열. 그래서 그 부분을 검사 함수로 내렸다.\n\n오른쪽 칸에 있던 것 중 일부가 왼쪽으로 내려갔다. 내려가는 만큼 그 자리에서 눈치싸움이 사라진다. 채점자의 취향을 학습해서 점수를 잘 받을 수는 있어도, 밑줄이 든 이름을 쓰면서 밑줄 검사를 통과할 수는 없다.\n\n느린 루프에서는 두 가지가 걸렸다. 낮은 점수만 보고 채점표를 고치면 채점표가 곧 목표가 된다. 게다가 채점표를 바꾸는 순간 그 항목의 전후 비교는 무효가 된다. 나아졌는지 잴 자를 방금 바꿨기 때문이다.\n\n그래서 낮은 점수는 생성기, 프롬프트, 입력 정제를 고칠 근거로만 둔다. 잣대를 고칠 근거는 사람 판단과 어긋난 기록뿐이다. 이 대가로 자동화의 속도는 사람 판단이 쌓이는 속도에 묶인다. 게을러서가 아니라 구조가 그렇다.\n\n## 사람이 남는 세 자리\n\n여기까지 오니 사람에게 남는 자리가 세 개로 줄었다.\n\n첫째, 잣대를 소유하는 자리다. 채점표와 명세는 사람이 승인한다. 하네스가 자동으로 통과시켰다고 확정하지 않는다. AI가 게이트를 만질 수 있으면 그건 게이트가 아니기 때문이다.\n\n둘째, 무엇을 올바름으로 볼지 정하는 자리다. 명세를 다 통과하는데 실제로는 틀린 구현이 있다. 예시를 늘리는 것만으로는 안 막힌다. 전체에 대해 참인 문장과 반례로 조여야 한다. 그래도 남는 것은 어떤 관찰로 정답 기준을 드러낼지의 문제다.\n\n입력과 출력을 비교해서 안 걸리면 실행 시간을 재야 할 수도 있다. 그래도 안 걸리면 동시에 여러 요청을 넣어봐야 할 수도 있다. 그래도 안 걸리면 사람이 설계를 뜯어봐야 한다. 속도도 요구사항인지, 보안도 요구사항인지, 동시성도 봐야 하는지는 저절로 나오지 않는다. 이 시스템에서 무엇을 올바름으로 볼지는 사람이 정한다.\n\n셋째, 게이트가 통과시킨 것을 의심하는 자리다. 결제사와 통신하는 코드를 AI에게 만들게 했을 때 검사 네 단계를 전부 통과했고 인수테스트 21개가 초록불이었다. 그런데 거절된 결제를 승인으로 처리하고 있었다.\n\n```java\nthis.chargeUri = URI.create(baseUrl + \"/payments\");\nreturn response.getStatusCode().is2xxSuccessful();\n```\n\n실제 주소는 `/charge`였고, 거절도 정상 응답에 `approved: false`로 온다. 게이트가 못 잡은 이유는 결제가 테스트에서 항상 가짜로 대체되어 이 코드가 실행되지 않았기 때문이다.\n\n잡은 것은 게이트가 아니라 AI가 함께 낸 메모였다. 결제사의 주소와 응답 형식이 입력에 없고, 자신은 2xx를 승인으로 가정했으며, 이 가정은 검증되지 않았다는 내용이었다. 그 문장을 보고 설정 파일을 열었고, 거기서 계약을 확인했다.\n\nAI의 흔들리는 출력에도 자리는 있다. 다만 판정석이 아니라 증인석이다. “내가 무엇을 가정했는가”는 합격 근거가 될 수 없지만, 사람이 확인할 단서가 될 수 있다.\n\n## 내가 쓰는 성장의 정의\n\n지금 쓰는 정의는 이렇다.\n\n**성장이란, 내가 틀렸다는 사실이 나 없이도 드러나는 자리를 하나 더 만드는 것이다.**\n\n이 정의를 고른 이유는 셀 수 있기 때문이다. 3주 동안 늘어난 자리가 있다. 실제로 돌아가는 인수 게이트 하나, 숫자로 세는 설계 규칙 하나, 형식을 막는 검사와 확인 불가능한 문장을 막는 검사, 평균으로 못 때우게 하는 항목별 하한, 채점하는 쪽과 고치는 쪽을 끊어놓은 구조, 사람이 승인한 뒤 잠그는 절차, 안 풀린 문제를 풀린 척하지 않고 적어둔 문서. 3주 전에는 내 인상 하나였다.\n\n대가도 분명하다. 이 정의를 택하면 내가 틀리는 것을 더 자주 본다. 검사 전부를 통과하고 인수테스트 21개가 초록인데 결제 거절을 승인으로 처리하던 코드를 봤다. 5점 만점에 합격선이 4.3인데 정확히 4.3으로 넘어간 산출물도 봤다. 세 번까지만 고쳐 쓸 수 있게 해둔 규칙에서 세 번째에 겨우 통과한 산출물도 봤다. 한 번만 더 실패했으면 결과물이 아니라 실패 기록이 남았을 것이다.\n\n어디까지 했는지는 분명하다. 빠른 루프를 세웠고, 그 위에 느린 루프를 설계하면서 안전장치를 걸었다. 판정을 세 칸으로 나눴고, 오른쪽에서 왼쪽으로 한 건 옮겼다. 각 결론이 어떤 관측에서 나왔는지도 남겼다.\n\n무엇을 못 했는지도 분명하다. 사람 판단을 붙인 산출물을 얼려두는 장치를 만들지 못했다. 그래서 채점표를 믿을 만하게 고치지 못한다. 승인 병목도 재지 못했다. 승인 1회에 몇 분이 드는지, 실행 횟수와 외부 연동 개수 중 무엇에 더 묶이는지 모른다. 확인할 잣대 목록이 실제로 도움이 되는지도 아직 돌려보지 못했다.\n\n다음에는 사람 판단을 기록으로 모으는 것부터 한다. 채점표를 고칠 자격을 얻는 유일한 길이 그것이기 때문이다. 그게 없으면 나머지 설계는 공중에 뜬다.\n\n이제 나는 “잘 짰나?”를 먼저 묻지 않는다. “이건 무엇으로 판정되나?”를 먼저 묻는다. 재현되는 판정은 넘기되, 그 판정의 적용 범위는 계속 의심한다. 재현되지 않는 판정은 신호로만 받는다. 그리고 잣대는 넘기지 않는다.\n\n팀에 가져가야 하는 것도 더 빠른 구현만은 아니라고 생각한다. 남이 다시 돌려보고, 같은 실패를 보고, 같은 이유로 기각할 수 있는 판정 기록이다.\n\n잣대를 쥐고 있어야 그것을 한 칸씩 왼쪽으로 옮길 수 있다. 잣대를 놓치면 실력이 느는 것이 아니라, 틀린 것을 못 알아보는 속도만 는다.",
  "generated_at": "2026-08-24T10:55:36+09:00",
  "model": "gpt-5.5",
  "metadata": {
    "prompt_version": "refine_system:v1",
    "source_files": [
      "d264193d_input.json"
    ],
    "token_usage": {
      "input_tokens": 52101,
      "cached_input_tokens": 20864,
      "output_tokens": 4817,
      "reasoning_output_tokens": 396
    }
  }
}
