{
  "brief_hash": "310164c7",
  "iteration": "001",
  "stage": "gen",
  "content": "# 더 맡길수록 내가 남아 있어야 할 곳이 보였다\n\n나는 일을 넘기려고 할수록 오히려 내가 어디에 서 있어야 하는지 더 자주 묻게 됐다. 회사에서 결제 기능을 붙이던 때, 코드는 1000줄과 2000줄로 불어났고 하나를 바꾸려면 어디까지 건드려야 하는지부터 흐려졌다.\n\n그때 없던 것은 지식이 아니었다. 이 코드가 괜찮은지 판단할 근거였다. 내 인상은 2000줄 앞에서 이미 신뢰를 잃고 있었다.\n\n그래서 결론을 미리 정하지 않았다. 사람이 하던 일을 한 칸씩 실제로 밀어봤다. 어디까지 넘어가는지 알아야, 남겨야 할 일이 무엇인지도 볼 수 있었다.\n\n## 처음 넘어간 것은 타이핑이었다\n\n처음에는 AI를 정말 도구처럼 썼다. 물어보고, 코드를 짜게 하고, 검토해달라고 했다. 같은 지시를 다시 쓰고, 큰 일을 작은 덩어리로 나눠 맡겼다.\n\n이 칸에서 넘어간 것은 손으로 쓰는 시간이었다. 반복되는 문장, 뻔한 코드, 먼저 훑어보는 검토가 줄었다.\n\n하지만 무엇을 시킬지와 어디서 멈출지는 그대로 남았다. AI는 대답했지만, 그 대답을 일로 만들지 말지는 내가 정했다.\n\n## 같은 코드에 다른 답이 왔다\n\n다음에는 판단을 넘기려 했다. 구독 서비스의 환불 규칙을 놓고 실험했다. 결제 후 7일 이내면 전액 환불, 8일째부터는 남은 기간만큼 계산, 이미 환불된 주문은 거절, 앱스토어와 구글플레이 결제는 이 경로로 환불할 수 없다는 식의 규칙 열 개 남짓이었다.\n\n먼저 사람이 읽는 시나리오 18개를 적었다. 문장이지만 기계가 그대로 실행해 통과와 실패를 낼 수 있는 형태였다. AI가 새로 짠 코드는 이 시나리오에서 16개를 통과하고 2개를 실패했다. 실패한 둘은 앱스토어와 구글플레이 결제 주문의 환불 거절이었다. AI가 짠 코드에는 결제 플랫폼이라는 개념 자체가 없었다.\n\n같은 코드를 AI에게 보여주고 평가하게 하자 중간 심각도 3건, 낮은 심각도 1건이 나왔다. 관리자 지정 금액이 우선순위를 우회한다거나, 일할 계산을 바로 부르는 공개 함수가 7일 무료 규칙을 건너뛴다는 지적은 말이 됐다. 그런데 실제로 실패한 2건은 한 줄도 언급하지 못했다.\n\n여기서 코드를 짠 AI에게 그 코드를 평가하게 하고, 그 평가를 합격 근거로 쓰는 안을 버렸다. 같은 코드에 매번 다른 답이 오면 전후를 비교할 기준조차 되지 않는다.\n\n## 셀 수 있는 것은 검사로 내렸다\n\n갈린 것은 옳고 그름이 아니라 재현되느냐였다. 시나리오는 몇 번을 돌려도 같은 2개를 짚었다. AI에게 다시 물으면 다른 것을 짚었다.\n\n그래서 일을 세 칸으로 갈랐다. 정해진 형식을 지켰는지, 본문에 나오면 안 되는 표현이 나왔는지, 시나리오가 통과하는지처럼 같은 입력에 같은 답이 나오는 일은 코드가 맡았다. 글이 잘 쓰였는지, 근거가 붙었는지처럼 바로 대조하기 어려운 일은 셀 수 있는 항목과 점수로 바꿔 AI가 평가하게 했다. 그리고 이 산출물을 승인할지, 애초에 무엇을 옳다고 볼지는 사람이 남겼다.\n\n가운데 칸이 제일 위험했다. 숫자가 붙어 있어서 결정적인 척했지만, 결정적이지 않았다. 같은 내용의 같은 항목이 4점과 2.5점으로 갈렸다.\n\n처음 만든 채점표도 기준이 아니었다. 서로 다른 초안 세 편에 같은 항목 점수 세 개를 똑같이 줬다. 도입도 문체도 분량도 결론도 다른 글이었다. 5점의 설명이 “자연스럽게 이어진다”, “단단히 받친다” 같은 좋음의 정도였기 때문이다.\n\n다음 채점표에서는 5점의 설명을 확인 가능한 요소가 있는지 없는지로 바꿨고, 항목도 여덟으로 늘렸다. 통과선도 두 번 버렸다. 3.8로 두면 첫 초안이 대부분 통과해 검토와 고쳐 쓰기가 실행되지 않았다. 4.3으로 두면 같은 재료로 네 번 고쳐도 닿지 못했고, 그 위로 가려는 퇴고는 재료에 없는 문장을 만들었다. 그래서 4.2와 고쳐쓰기 3회로 정했다.\n\n## 점수로 다시 쓰게 하자 거짓이 올라왔다\n\n그다음에는 AI가 자기 글을 스스로 고치게 했다. 점수를 매기고, 그 점수를 보고 다시 쓰는 파이프라인을 붙였다. 파이프라인은 여러 단계를 이어 한 산출물을 만들고 검사하는 작업 흐름이다.\n\n이 칸에서 넘어간 것은 사람이 읽고 고쳐 쓰던 자리였다. 하지만 점수를 믿을 근거가 남았다.\n\n초안이 재료에 없는 1인칭 경험과 감정을 지어낸 일이 있었다. 그 문장들은 글을 그럴듯하게 만드는 자리에 정확히 들어갔다. 채점표는 이걸 못 잡았다. 지어낸 서술이 네 건 있는 초안이 근거 항목에서 4.8을 받고, 깨끗한 초안이 4.5를 받았다. 방향이 반대였다.\n\n그래서 찾아내는 일을 채점이 아니라 대조로 옮겼다. 본문의 1인칭 서술을 저자가 준 재료와 하나씩 맞춰 근거 없는 것을 목록으로 내게 했다. 같은 지시로 지어낸 초안에서는 4건, 깨끗한 초안에서는 0건이 나왔다.\n\n같은 자리에서 권한도 줄였다. 채점하는 쪽이 자기가 대조당하는 통과선을 읽을 수 있었기 때문이다. 매번 새 빈 폴더에서 돌게 막자 재료에 없던 말만 정확히 사라졌고, 총점은 4.31에서 4.06으로 내려갔다. 지어낸 구체성이 점수를 벌고 있었다.\n\n## 점수와 검사는 다른 실패를 잡았다\n\n점수와 별도로, 기계로 확인 가능한 것만 보는 검사를 따로 뒀다. 정해진 형식을 벗어났는지, 목표 분량을 넘겼는지, 본문에 나오면 안 되는 표현이 나왔는지, 재료에 없는 인용을 붙였는지 같은 것들이다.\n\n점수로는 통과할 초안을 이 검사가 막은 경우가 다섯 번 있었다. 초안이 들어갈 자리에 정해진 형식을 벗어난 덩어리가 들어갔는데도 채점자가 통과 점수를 준 사례가 있었다. 반대로 검사는 통과했는데 점수가 모자란 경우도 있었다.\n\n둘은 같은 실패가 아니었다. 고쳐 쓰는 일은 넘어갔지만, 무엇을 어떤 방식으로 막을지는 남았다.\n\n## 고치는 제안까지 넘어갔다\n\n하네스라는 이름으로 부른 작업 묶음은 산출물을 만들고, 평가하고, 고쳐 쓰고, 기록을 남기는 전체 흐름이다. 산출물 하나를 만들고 보는 빠른 흐름 위에, 그 실행 기록을 모아 하네스 자체를 고칠 제안을 만드는 느린 흐름을 얹었다.\n\n신호를 모으는 일은 코드가 했다. 무엇을 어떻게 고칠지 제안하는 일은 AI가 했다. 실제로 기준을 바꾸는 일은 사람이 했다.\n\n낮은 점수는 어디를 고칠지 말해주지 않는다. 근거 항목이 낮게 나온 원인은 초안 생성, 고쳐쓰기, 기준, 채점, 재료를 받는 규칙 중 어디에나 있을 수 있었다. 그래서 집계하는 코드는 고칠 대상을 정하지 않고 신호와 후보만 띄웠다.\n\n제안은 꽤 구체적으로 나왔다. 어느 문장이 원인인지, 어떤 항목 점수를 올리려는지, 고치면 왜 올라가는지, 다른 가능성은 왜 아닌지, 부작용은 무엇인지, 실제로 넣을 문장까지 붙었다. 세 건이 실제로 적용됐다. 강조하기로 한 주제를 글의 비중 중심으로 삼으라는 지시, 재료에 있는 핵심 결정과 선택 이유를 생략하지 말라는 지시, 결론을 한계 나열로 끝내지 말라는 지시였다.\n\n이 칸에서 넘어간 것은 유지보수 제안이었다. 남은 것은 그 제안을 받아들여 실제 기준을 바꿀지 정하는 일이었다.\n\n## 자기 심판까지 고치게 하지는 않았다\n\n여기서 한 칸 더 올라가는 길은 막았다. 느린 흐름이 자기가 쓰는 채점표와 지시문, 집계 코드까지 고치게 하면 순환이 끊기지 않는다.\n\n이유는 둘이었다. 채점표가 곧 최적화 목표가 된다. 그리고 채점표를 바꾸면 그 항목의 전후 비교가 정의상 무효가 된다. 점수가 낮아서 채점표를 고쳤다고 한 뒤에 “고쳤더니 나아졌다”고 말할 방법이 없다. 나아졌는지 잴 자를 방금 바꿨기 때문이다.\n\n그래서 낮은 점수를 잣대를 고칠 근거로 쓰는 경로를 버렸다. 점수가 낮다는 것은 채점표를 고칠 근거가 못 되고, 채점표가 사람 판단과 어긋난다는 것만 근거가 된다.\n\n채점표를 바꾸고 싶다면 먼저 사람이 판단을 붙여둔 옛 산출물 몇 개를 얼려둬야 한다. 새 채점표로 그것들을 다시 채점해 사람 판단과 더 비슷하게 나오는 쪽을 골라야 전후 비교가 성립한다.\n\n정직한 제약도 남았다. 채점표를 믿을 만하게 바꿀 수 있는 속도는 사람 판단이 쌓이는 속도에 묶인다.\n\n## 다른 일에서도 같은 순서가 반복됐다\n\n이 흐름이 글쓰기 하네스 안에만 묶인 것은 아니었다. 콘텐츠 자동화를 만들 때 받은 스토리보드가 빈약해서 바로 다음 단계로 넘기기 어려웠다.\n\n그래서 먼저 그 스토리보드를 구체화하는 AI 실행 단위를 만들었다. 그 응답을 토대로 질문하는 역할과 답하는 역할을 나눠, 내가 수동으로 하던 인터뷰를 자동화했다.\n\n여기서 버린 생각이 하나 더 있다. 아직 안 넘어간 일은 원래 못 넘기는 일이라는 생각이다. 사람 둘이 마주 앉아 하던 인터뷰도, 순서를 나눠 밀어보니 넘어갔다.\n\n그렇다고 결국 사람이 다 해야 한다는 결론도 맞지 않았다. 네 단에서 넘긴 것들은 실제로 넘기는 게 맞았고, 넘긴 뒤가 더 나았다. 다만 칸마다 남은 것이 있었다.\n\n## 남은 것들은 같은 곳을 가리켰다\n\n남은 것들을 모아보면 방향이 같았다. 채점표를 쓰는 일, 점수를 믿을 근거를 만드는 일, 채점표를 바꿀지 정하는 일은 모두 무엇을 옳다고 볼지의 문제였다.\n\n아예 안 대본 잣대는 아무리 시험해도 안 걸린다. 요구사항을 안 적은 빠뜨림은 같은 방식으로 더 많이 시험하면 언젠가 걸린다. 하지만 잴 잣대 자체를 안 챙긴 빠뜨림은 두 구현이 모든 검사에서 똑같아 보인다. 속도도 요구사항인지, 보안도 요구사항인지는 물리 법칙이 아니라 이 시스템에서 무엇을 올바름으로 볼지의 문제다.\n\n아직 깨지는 조건도 남아 있다. 결정적으로 잡을 수 있는 것과 없는 것을 가르는 선이 지금 자리에 맞다는 근거는 약하다. 흉내에 있던 것 하나를 문자열 검사로 내려봤지만, 그렇게 내릴 수 있는 게 얼마나 더 남았는지는 세지 못했다.\n\n세로로 막힌 것이 원리가 아니라 순서라는 판단도 아직 추정이다. 사람 판정을 쌓아 열어봐야 한다. 사람 판정이 채점표보다 낫다는 전제도 검증되지 않았다. 사다리가 도메인에 안 묶인다는 판단은 사례가 두 개뿐이다. 이 배치 전체는 사람이 잣대를 계속 들여다볼 시간이 있을 때만 성립하고, 승인에 드는 시간은 아직 재지 못했다. 넘긴 판단 중 반쯤만 결정적인 것이 섞여 있으면 통과는 하는데 틀린 산출물이 늘어날 수 있다.\n\n지금 통과선 4.2도 사람 판정에서 역산한 값이 아니다. 같은 재료로 하네스를 고쳐가며 뽑은 초안 아홉 편을 남겼지만 판정란이 비어 있다. 독자에게 읽히는지를 보는 항목은 스무 번 넘게 돌리는 동안 3.5에서 4.2 사이에서만 움직였다. 그 항목이 실제로 안 나아진 것을 재고 있는지, 아니면 눈이 먼 것인지는 지금 데이터로 가를 수 없다.\n\n그래서 다음 일은 분명하다. 사람이 판단을 붙인 산출물을 얼려두고, 새 채점표가 그 판단에 더 가까워지는지 봐야 한다. 그 전까지 이 하네스는 여전히 자기 참조 안에 있다.\n\n## 성장은 더 많이 쥐는 일이 아니었다\n\n이 과정을 지나며 성장을 다시 정의하게 됐다. 더 많은 일을 직접 붙잡는 것이 아니라, 넘길 수 있는 일을 실제로 넘겨보고, 남은 일이 무엇인지 더 좁고 정확하게 보는 일에 가까웠다.\n\n그 정의에는 대가가 있다. 손이 덜 가는 대신, 사람이 들고 있어야 할 잣대가 더 선명해진다. 결정적으로 잡을 수 있는 것은 코드와 검사로 내려야 한다. 흔들리는 점수는 판정이 아니라 신호로 읽어야 한다. 그리고 무엇을 옳다고 볼지는 자동화의 바깥에 잠시 남겨둬야 한다.\n\n처음에는 더 맡기면 내가 사라질 줄 알았다. 지금은 반대로 본다. 더 맡길수록, 내가 남아 있어야 할 자리가 더 좁고 더 무겁게 드러난다.",
  "generated_at": "2026-08-25T15:46:00+09:00",
  "model": "gpt-5.5",
  "metadata": {
    "prompt_version": "gen_system:v3",
    "source_files": [
      "310164c7_input.json"
    ],
    "token_usage": {
      "input_tokens": 32421,
      "cached_input_tokens": 2432,
      "output_tokens": 3952,
      "reasoning_output_tokens": 516
    }
  }
}
