{
  "brief_hash": "a1b2c3d4",
  "iteration": "001",
  "stage": "gen",
  "content": "처음에는 좋은 프롬프트를 쓰면 글 품질이 올라갈 것이라고 생각했다. 문장을 더 정교하게 지시하고, 톤을 더 분명히 적고, 금지할 표현을 세밀하게 나열하면 초안도 자연스럽게 좋아질 것 같았다. 글쓰기 하네스를 만들기 시작한 이유도 그 기대와 가까웠다. AI가 매번 감으로 초안을 쓰는 것이 아니라, 같은 입력에서 다시 실행하고 비교할 수 있는 구조를 만들고 싶었다.\n\n그런데 막상 설계를 시작하자 중심은 프롬프트가 아니었다. 더 자주 문제를 일으킨 것은 파일 계약과 역할 경계였다. 어떤 stage가 어떤 파일을 읽어도 되는지, 어떤 JSON을 받아 어떤 JSON을 내보내야 하는지, 실패했을 때 무엇을 남겨야 하는지가 흐려지면 프롬프트를 아무리 잘 써도 시스템은 금방 불안해졌다. Generator가 초안을 만들고, Critique가 약한 지점과 보존할 강점을 보고, Eval이 독립적으로 루브릭을 적용하고, Refine이 수정하고, Validate가 기계적 계약을 확인한다는 분리는 단순한 이름 붙이기가 아니었다. 서로의 판단을 섞지 않기 위한 장치였다.\n\n특히 runner.py의 책임이 커졌던 시행착오가 컸다. 처음에는 runner가 전체 흐름을 알고 있으니 많은 일을 맡겨도 된다고 생각했다. 입력을 읽고, payload를 만들고, stage를 실행하고, 결과를 감싸고, 검증까지 연결하는 것은 자연스러워 보였다. 하지만 책임이 조금씩 붙기 시작하자 구조가 금방 무거워졌다. runner가 똑똑해질수록 각 stage의 경계는 흐려졌고, 나중에 무엇을 바꿔야 하는지 판단하기 어려워졌다. 흐름 제어와 생성 책임이 한곳에 섞이면, 작은 수정도 전체 파이프라인의 의미를 건드리게 된다.\n\n그래서 방향을 다시 잡았다. generator.py는 생성만 맡고, runner.py는 흐름 제어만 맡아야 한다. validate.py도 글이 좋은지 나쁜지 판단하는 곳이 아니라 schema와 기계적 계약만 확인하는 곳이어야 한다. 문학적 품질 판단을 validator에 넣는 순간, 재현 가능한 검사와 주관적 평가가 뒤섞인다. 실패 원인을 읽을 수 있어야 하는 하네스에서 그런 혼합은 오히려 개선을 어렵게 만든다.\n\n이번에 배운 것은 AI 글쓰기 자동화의 핵심이 “더 좋은 한 번의 지시”에만 있지 않다는 점이다. 반복 가능한 초안을 만들려면 프롬프트보다 먼저 입력과 출력의 모양, 역할의 책임, stage 사이의 정보 차단을 설계해야 한다. AI가 모든 것을 자동으로 해결해주기를 기대하기보다, AI가 실패했을 때 어디서 실패했는지 볼 수 있는 구조를 만드는 일이 더 중요했다.\n\n다음 실험은 범위를 작게 고정하는 것이다. MVP는 input.json에서 시작해 gen을 거쳐 draft.json을 만들고, validate까지 통과시키는 흐름만 먼저 단단하게 만든다. 그 다음에 Critique, Eval, Refine을 붙이더라도 각 stage가 자기 책임을 넘지 않는지 확인할 수 있어야 한다. 좋은 글쓰기 하네스는 거대한 자동화가 아니라, 작은 계약들이 반복해서 깨지지 않는 구조에서 출발한다.",
  "generated_at": "2026-06-12T23:38:52+09:00",
  "model": "gpt-5.5",
  "metadata": {
    "prompt_version": "gen_system:v1",
    "source_files": [
      "a1b2c3d4_input.json"
    ],
    "token_usage": {
      "input_tokens": 14669,
      "cached_input_tokens": 9088,
      "output_tokens": 974,
      "reasoning_output_tokens": 172
    }
  }
}
