{
  "brief_hash": "85685f51",
  "iteration": "001",
  "stage": "gen",
  "content": "Feature: 구독 결제 주문 환불 정책\n  구독 결제 주문의 환불 금액, 환불 유형, 환불 가능 여부, 환불 상태와 주문 상태 전이를 계약으로 고정한다.\n\n  Background:\n    Given 모든 금액은 원 단위로 계산한다\n    And 경과일은 결제 시각과 환불 요청 시각의 UTC 날짜에서 시분초를 제거해 계산한다\n\n  Scenario: 환불 가능한 결제 완료 주문을 7일 이하 무료 정책으로 전액 환불한다\n    Given 주문금액이 30000원이고 이미 환불된 금액이 0원인 PAID 주문이 있다\n    And 결제 시각은 \"2026-07-01T10:00:00Z\"이고 환불 요청 시각은 \"2026-07-08T09:59:59Z\"이다\n    And MANUAL 지정금액은 없다\n    And 총 구독 일수는 30일이고 잔여 일수는 23일이다\n    When 환불 금액과 환불 유형을 산출하고 환불을 적용한다\n    Then 경과일은 7일로 판정된다\n    And 환불금액은 30000원이다\n    And 환불 유형은 FULL이다\n    And 주문 상태는 REFUNDED가 된다\n\n  Scenario: MANUAL 지정은 7일 이하 무료 정책보다 우선한다\n    Given 주문금액이 30000원이고 이미 환불된 금액이 0원인 PAID 주문이 있다\n    And 결제 시각은 \"2026-07-01T00:00:00Z\"이고 환불 요청 시각은 \"2026-07-07T23:59:59Z\"이다\n    And MANUAL 지정금액은 5000원이다\n    And 총 구독 일수는 30일이고 잔여 일수는 24일이다\n    When 환불 금액과 환불 유형을 산출한다\n    Then 환불금액은 5000원이다\n    And 환불 유형은 PARTIAL이다\n\n  Scenario Outline: 7일 이하 무료 정책의 경계는 UTC 날짜 기준 경과일로 판단한다\n    Given 주문금액이 30000원이고 이미 환불된 금액이 0원인 PAID 주문이 있다\n    And 결제 시각은 <결제시각>이고 환불 요청 시각은 <환불요청시각>이다\n    And MANUAL 지정금액은 없다\n    And 총 구독 일수는 30일이고 잔여 일수는 <잔여일수>일이다\n    When 환불 금액과 환불 유형을 산출한다\n    Then 경과일은 <경과일>일로 판정된다\n    And 환불금액은 <환불금액>원이다\n    And 환불 유형은 <환불유형>이다\n\n    Examples:\n      | 결제시각               | 환불요청시각           | 경과일 | 잔여일수 | 환불금액 | 환불유형 |\n      | \"2026-07-01T00:00:00Z\" | \"2026-07-01T23:59:59Z\" | 0      | 30       | 30000    | FULL     |\n      | \"2026-07-01T00:00:00Z\" | \"2026-07-08T23:59:59Z\" | 7      | 23       | 30000    | FULL     |\n      | \"2026-07-01T00:00:00Z\" | \"2026-07-09T00:00:00Z\" | 8      | 22       | 22000    | PARTIAL  |\n\n  Scenario Outline: PRORATION은 일할 단가를 정수 나눗셈으로 구하고 잔여 일수에 곱한다\n    Given 주문금액이 <주문금액>원이고 이미 환불된 금액이 0원인 PAID 주문이 있다\n    And PRORATION으로 환불 금액을 산출할 대상이다\n    And 총 구독 일수는 <총일수>일이고 잔여 일수는 <잔여일수>일이다\n    When 환불 금액과 환불 유형을 산출한다\n    Then 환불금액은 <환불금액>원이다\n    And 환불 유형은 <환불유형>이다\n\n    Examples:\n      | 주문금액 | 총일수 | 잔여일수 | 환불금액 | 환불유형 |\n      | 30000    | 30     | 30       | 30000    | FULL     |\n      | 30000    | 30     | 15       | 15000    | PARTIAL  |\n      | 30000    | 30     | 1        | 1000     | PARTIAL  |\n      | 30000    | 30     | 0        | 0        | PARTIAL  |\n      | 10000    | 30     | 7        | 2331     | PARTIAL  |\n\n  Scenario Outline: PRORATION은 총 구독 일수가 0 이하이면 거절한다\n    Given 주문금액이 30000원이고 이미 환불된 금액이 0원인 PAID 주문이 있다\n    And PRORATION으로 환불 금액을 산출할 대상이다\n    And 총 구독 일수는 <총일수>일이고 잔여 일수는 0일이다\n    When 환불 금액과 환불 유형을 산출한다\n    Then 잘못된 구독 기간으로 환불 금액 산출이 거절된다\n\n    Examples:\n      | 총일수 |\n      | 0      |\n      | -1     |\n\n  Scenario Outline: MANUAL은 지정금액이 환불 가능 금액 이하이고 0원보다 크면 지정금액을 따른다\n    Given 주문금액이 30000원이고 이미 환불된 금액이 <이미환불된금액>원인 <주문상태> 주문이 있다\n    And MANUAL 지정금액은 <지정금액>원이다\n    And 결제 시각은 \"2026-07-01T00:00:00Z\"이고 환불 요청 시각은 \"2026-07-20T00:00:00Z\"이다\n    And 총 구독 일수는 30일이고 잔여 일수는 11일이다\n    When 환불 금액과 환불 유형을 산출한다\n    Then 환불 가능 금액은 <환불가능금액>원이다\n    And 환불금액은 <환불금액>원이다\n    And 환불 유형은 <환불유형>이다\n\n    Examples:\n      | 주문상태           | 이미환불된금액 | 지정금액 | 환불가능금액 | 환불금액 | 환불유형 |\n      | PAID               | 0              | 30000    | 30000        | 30000    | FULL     |\n      | PAID               | 0              | 29999    | 30000        | 29999    | PARTIAL  |\n      | PARTIALLY_REFUNDED | 10000          | 1        | 20000        | 1        | PARTIAL  |\n      | PARTIALLY_REFUNDED | 10000          | 20000    | 20000        | 20000    | FULL     |\n\n  Scenario Outline: MANUAL 지정금액이 허용 범위를 벗어나면 거절한다\n    Given 주문금액이 30000원이고 이미 환불된 금액이 <이미환불된금액>원인 <주문상태> 주문이 있다\n    And MANUAL 지정금액은 <지정금액>원이다\n    When 환불 금액과 환불 유형을 산출한다\n    Then MANUAL 지정금액 오류로 환불 금액 산출이 거절된다\n\n    Examples:\n      | 주문상태           | 이미환불된금액 | 지정금액 |\n      | PAID               | 0              | 30001    |\n      | PAID               | 0              | 0        |\n      | PAID               | 0              | -1       |\n      | PARTIALLY_REFUNDED | 10000          | 20001    |\n\n  Scenario Outline: 환불 유형은 환불금액과 환불 가능 금액의 비교로 결정한다\n    Given 주문금액이 30000원이고 이미 환불된 금액이 <이미환불된금액>원인 <주문상태> 주문이 있다\n    And 환불금액은 <환불금액>원으로 확정되어 있다\n    When 환불 유형을 결정한다\n    Then 환불 가능 금액은 <환불가능금액>원이다\n    And 환불 유형은 <환불유형>이다\n\n    Examples:\n      | 주문상태           | 이미환불된금액 | 환불금액 | 환불가능금액 | 환불유형 |\n      | PAID               | 0              | 30000    | 30000        | FULL     |\n      | PAID               | 0              | 29999    | 30000        | PARTIAL  |\n      | PARTIALLY_REFUNDED | 10000          | 20000    | 20000        | FULL     |\n      | PARTIALLY_REFUNDED | 10000          | 19999    | 20000        | PARTIAL  |\n\n  Scenario Outline: 환불 가능한 주문 상태에서는 환불금액이 환불 가능 금액 이하일 때 검증을 통과한다\n    Given 주문금액이 30000원이고 이미 환불된 금액이 <이미환불된금액>원인 <주문상태> 주문이 있다\n    And 환불금액은 <환불금액>원으로 확정되어 있다\n    When 환불 가능 여부를 검증한다\n    Then 환불 가능 검증은 성공한다\n    And 환불 가능 금액은 <환불가능금액>원이다\n\n    Examples:\n      | 주문상태           | 이미환불된금액 | 환불금액 | 환불가능금액 |\n      | PAID               | 0              | 30000    | 30000        |\n      | PAID               | 0              | 29999    | 30000        |\n      | PARTIALLY_REFUNDED | 10000          | 20000    | 20000        |\n      | PARTIALLY_REFUNDED | 10000          | 19999    | 20000        |\n\n  Scenario Outline: 환불 불가 주문 상태에서는 환불 가능 검증을 거절한다\n    Given 주문금액이 30000원이고 이미 환불된 금액이 <이미환불된금액>원인 <주문상태> 주문이 있다\n    And 환불금액은 1000원으로 확정되어 있다\n    When 환불 가능 여부를 검증한다\n    Then 환불 불가 상태로 환불이 거절된다\n\n    Examples:\n      | 주문상태 | 이미환불된금액 |\n      | REFUNDED | 30000          |\n      | PENDING  | 0              |\n      | FAILED   | 0              |\n\n  Scenario: 환불금액이 환불 가능 금액을 초과하면 환불 가능 검증을 거절한다\n    Given 주문금액이 30000원이고 이미 환불된 금액이 10000원인 PARTIALLY_REFUNDED 주문이 있다\n    And 환불금액은 20001원으로 확정되어 있다\n    When 환불 가능 여부를 검증한다\n    Then 환불 가능 금액 초과로 환불이 거절된다\n\n  Scenario Outline: 환불 적용 후 누적 환불액이 주문금액에 도달했는지에 따라 주문 상태를 전이한다\n    Given 주문금액이 30000원이고 이미 환불된 금액이 <이미환불된금액>원인 <환불전상태> 주문이 있다\n    And 환불금액은 <환불금액>원으로 확정되어 있다\n    When 환불을 주문에 적용한다\n    Then 주문 상태는 <환불후상태>가 된다\n    And 누적 환불액은 <누적환불액>원이다\n\n    Examples:\n      | 환불전상태         | 이미환불된금액 | 환불금액 | 누적환불액 | 환불후상태         |\n      | PAID               | 0              | 30000    | 30000      | REFUNDED           |\n      | PAID               | 0              | 29999    | 29999      | PARTIALLY_REFUNDED |\n      | PARTIALLY_REFUNDED | 10000          | 20000    | 30000      | REFUNDED           |\n      | PARTIALLY_REFUNDED | 10000          | 19999    | 29999      | PARTIALLY_REFUNDED |\n\n  Scenario: 환불 요청이 생성되면 환불 상태는 REQUESTED이다\n    Given 주문금액이 30000원이고 이미 환불된 금액이 0원인 PAID 주문이 있다\n    And 환불금액은 15000원으로 확정되어 있다\n    When 환불 요청을 생성한다\n    Then 환불 상태는 REQUESTED이다\n\n  Scenario Outline: 결제 취소 결과 도메인 사건에 따라 환불 상태를 전이한다\n    Given 환불 상태가 REQUESTED인 환불 요청이 있다\n    When <결제취소결과> 도메인 사건이 발생한다\n    Then 환불 상태는 <환불상태>이다\n    And 관리자 수동 처리 필요 여부는 <관리자수동처리필요>이다\n\n    Examples:\n      | 결제취소결과 | 환불상태  | 관리자수동처리필요 |\n      | 취소 성공    | SUCCEEDED | false              |\n      | 명확한 거부  | FAILED    | false              |\n      | 결과 불확실  | TIMED_OUT | true               |",
  "generated_at": "2026-07-06T11:21:04+09:00",
  "model": "gpt-5.5",
  "metadata": {
    "prompt_version": "gen_system:v1",
    "source_files": [
      "85685f51_input.json"
    ],
    "token_usage": {
      "input_tokens": 181016,
      "cached_input_tokens": 105856,
      "output_tokens": 16465,
      "reasoning_output_tokens": 3251
    }
  }
}
